"Species","EEZ","p2","p4","Average","Max"
"Seriola dumerili","Albanian Exclusive Economic Zone",0,0,0.0210630438950098,0.190372867642977
"Seriola dumerili","Algerian Exclusive Economic Zone",0,0,0.00156801055622932,0.0244798593435832
"Seriola dumerili","American Samoa Exclusive Economic Zone",0,0,0.00544445884751126,0.0281500195646316
"Seriola dumerili","Angolan Exclusive Economic Zone",0,0,0.0513761725016545,0.535579125960618
"Seriola dumerili","Anguilla Exclusive Economic Zone",0,0,6.177708227565e-05,0.00027019435799517
"Seriola dumerili","Antigua and Barbuda Exclusive Economic Zone",0,0,2.54719808445157e-05,0.000170123912527867
"Seriola dumerili","Aruban Exclusive Economic Zone",0,0,3.16525631106472e-05,0.000325970649847115
"Seriola dumerili","Ascension Exclusive Economic Zone",0,0,0.00017945233018974,0.000569050942828654
"Seriola dumerili","Australian Exclusive Economic Zone",0,0,0.00335839148772887,0.121816915682675
"Seriola dumerili","Bahamas Exclusive Economic Zone",0,0,0.000472855722986532,0.0303311930682565
"Seriola dumerili","Bahraini Exclusive Economic Zone",0,0,0.0759199259384288,0.128894165487595
"Seriola dumerili","Barbados Exclusive Economic Zone",0,0,3.04064171019669e-05,0.000314368136291455
"Seriola dumerili","Bassas da India Exclusive Economic Zone",0,0,8.99050108535399e-05,0.000439704344582921
"Seriola dumerili","Belizean Exclusive Economic Zone",0,0,0.000783288816571928,0.0270216250203168
"Seriola dumerili","Beninese Exclusive Economic Zone",0,0,0.00428475876160789,0.0189185210485888
"Seriola dumerili","Bermudian Exclusive Economic Zone",0,0,0.00734788140360444,0.0159295382376954
"Seriola dumerili","Bonaire Exclusive Economic Zone",0,0,2.58544280691323e-05,7.72692062466026e-05
"Seriola dumerili","Brazilian Exclusive Economic Zone",0,0,0.0108310868104571,0.368624280035627
"Seriola dumerili","Brazilian Exclusive Economic Zone (Trindade)",0,0,0.000114605886053878,0.0002539059588901
"Seriola dumerili","British Virgin Islands Exclusive Economic Zone",0,0,0.000132657412437696,0.0009959336069031
"Seriola dumerili","Bruneian Exclusive Economic Zone",0,0,0.000380216964554018,0.00872235710715553
"Seriola dumerili","Cambodian Exclusive Economic Zone",0,0,0.00115036483177813,0.0138381817592978
"Seriola dumerili","Cameroonian Exclusive Economic Zone",0,0,0.0333544249150901,0.257289835793843
"Seriola dumerili","Canadian Exclusive Economic Zone",0.0609756097560976,0,0.335442860517446,3.97729661069368
"Seriola dumerili","Cape Verdean Exclusive Economic Zone",0,0,0.00366082671981997,0.0254782129695309
"Seriola dumerili","Cayman Islands Exclusive Economic Zone",0,0,2.58298438420342e-05,0.000200664637022027
"Seriola dumerili","Chagos Archipelago Exclusive Economic Zone",0,0,3.40570505080377e-05,0.000207936953951864
"Seriola dumerili","Chilean Exclusive Economic Zone",0,0,0.285978187294518,1.34671364601919
"Seriola dumerili","Chilean Exclusive Economic Zone (San Felix and San Ambrosio islands)",0,0,0.0622273688986946,0.174416758761779
"Seriola dumerili","Chinese Exclusive Economic Zone",0,0,0.0261120968230304,1.58779071028628
"Seriola dumerili","Christmas Island Exclusive Economic Zone",0,0,4.41022447026089e-05,0.000308723832433713
"Seriola dumerili","Clipperton Exclusive Economic Zone",0,0,3.59486643442327e-05,6.11846525156337e-05
"Seriola dumerili","Cocos Islands Exclusive Economic Zone",0,0,0.000187177747246606,0.000636681035110204
"Seriola dumerili","Colombian Exclusive Economic Zone",0,0,0.00833895587314178,0.496348139359445
"Seriola dumerili","Colombian Exclusive Economic Zone (Bajo Nuevo)",0,0,0.000119977532444543,0.000119977532444543
"Seriola dumerili","Colombian Exclusive Economic Zone (Quitasueño)",0,0,6.55408699792419e-05,0.000117574793610562
"Seriola dumerili","Colombian Exclusive Economic Zone (Serrana)",0,0,8.2186069968729e-05,0.000123691123636775
"Seriola dumerili","Colombian Exclusive Economic Zone (Serranilla)",0,0,0.00013550284429289,0.000182418900792349
"Seriola dumerili","Comoran Exclusive Economic Zone",0,0,5.92232159984961e-05,0.000307949826723582
"Seriola dumerili","Congolese Exclusive Economic Zone",0,0,0.0184006074712194,0.0184414200689991
"Seriola dumerili","Cook Islands Exclusive Economic Zone",0,0,0.00235103859871244,0.0149884995303834
"Seriola dumerili","Costa Rican Exclusive Economic Zone",0,0,0.0014475169965632,0.017244231170917
"Seriola dumerili","Croatian Exclusive Economic Zone",0,0,0.021933663637341,0.481211436557107
"Seriola dumerili","Cuban Exclusive Economic Zone",0,0,0.000409381181964281,0.0297153151815551
"Seriola dumerili","Curaçaoan Exclusive Economic Zone",0,0,1.68461797336184e-05,5.97644610347601e-05
"Seriola dumerili","Cypriote Exclusive Economic Zone",0,0,0.0060191056784932,0.0251114540464853
"Seriola dumerili","Democratic Republic of the Congo Exclusive Economic Zone",0,0,0.0496187106917919,0.0878471642829416
"Seriola dumerili","Djiboutian Exclusive Economic Zone",0,0,0.00591242705232517,0.0366175294844339
"Seriola dumerili","Dominican Exclusive Economic Zone",0,0,7.36082919254217e-06,3.11037816218846e-05
"Seriola dumerili","Dominican Republic Exclusive Economic Zone",0,0,0.000199532733889309,0.00305514683824095
"Seriola dumerili","East Timorian Exclusive Economic Zone",0,0,0.00381956031558415,0.0222254908986891
"Seriola dumerili","Ecuadorian Exclusive Economic Zone",0,0,0.0405678594900242,0.448781434996273
"Seriola dumerili","Ecuadorian Exclusive Economic Zone (Galapagos)",0,0,0.0528571783112154,0.74912973882101
"Seriola dumerili","Egyptian Exclusive Economic Zone",0,0,0.00411463110036735,0.01218599476554
"Seriola dumerili","El Salvador Exclusive Economic Zone",0,0,0.00559434203245615,0.0722862517563258
"Seriola dumerili","Equatorial Guinean Exclusive Economic Zone",0,0,0.00650390913544267,0.257289835793843
"Seriola dumerili","Eritrean Exclusive Economic Zone",0,0,0.0115430281851462,0.280132555531685
"Seriola dumerili","Fijian Exclusive Economic Zone",0,0,0.0169418724843996,1.733940085486
"Seriola dumerili","French Exclusive Economic Zone",0,0,0.025262890331368,0.911307929382573
"Seriola dumerili","French Guiana Exclusive Economic Zone",0,0,0.000774227895664921,0.0116113687424973
"Seriola dumerili","French Polynesian Exclusive Economic Zone",0,0,0.000372080105424523,0.00684937073956241
"Seriola dumerili","Gabonese Exclusive Economic Zone",0,0,0.00290981705929188,0.0859904315329603
"Seriola dumerili","Gambian Exclusive Economic Zone",0,0,0.0161307517216013,0.086337446411962
"Seriola dumerili","Ghanaian Exclusive Economic Zone",0,0,0.015755587313777,0.0857841400489955
"Seriola dumerili","Greek Exclusive Economic Zone",0,0,0.0153722447580197,0.204708081501846
"Seriola dumerili","Grenadian Exclusive Economic Zone",0,0,0.000316943182273598,0.0039347107363854
"Seriola dumerili","Guadeloupean Exclusive Economic Zone",0,0,1.4004007872203e-05,0.000152868572171189
"Seriola dumerili","Guam Exclusive Economic Zone",0,0,5.75102512924036e-05,0.000182347009298949
"Seriola dumerili","Guatemalan Exclusive Economic Zone",0,0,0.00505833770845158,0.06952660855099
"Seriola dumerili","Guinea Bissau Exclusive Economic Zone",0,0,0.00158990105973042,0.0309772968259334
"Seriola dumerili","Guinean Exclusive Economic Zone",0,0,0.000713465909778318,0.0359923773385233
"Seriola dumerili","Guyanese Exclusive Economic Zone",0,0,0.00141336891913644,0.0214235165221774
"Seriola dumerili","Haitian Exclusive Economic Zone",0,0,2.80632654832341e-05,0.000280430569340347
"Seriola dumerili","Honduran Exclusive Economic Zone",0,0,0.000602685232105241,0.0722862517563258
"Seriola dumerili","Howland and Baker Islands Exclusive Economic Zone",0,0,0.00185514054672843,0.00289954739134021
"Seriola dumerili","Ile Europa Exclusive Economic Zone",0,0,9.27387651383777e-05,0.000439704344582921
"Seriola dumerili","Indian Exclusive Economic Zone",0,0,0.00908907935204138,0.41082913646195
"Seriola dumerili","Indian Exclusive Economic Zone (Andaman and Nicobar Islands)",0,0,0.000840610508044257,0.0202469901751411
"Seriola dumerili","Indonesian Exclusive Economic Zone",0,0,0.00238993468150537,0.368219801266935
"Seriola dumerili","Iranian Exclusive Economic Zone",0,0,0.0800891471849963,0.94907146676752
"Seriola dumerili","Israeli Exclusive Economic Zone",0,0,0.00329379754365127,0.01218599476554
"Seriola dumerili","Italian Exclusive Economic Zone",0,0,0.0193912263776748,1.35542174795507
"Seriola dumerili","Ivory Coast Exclusive Economic Zone",0,0,0.0205492179881455,0.161144158269576
"Seriola dumerili","Jamaican Exclusive Economic Zone",0,0,4.78527663388302e-05,0.000220754327746184
"Seriola dumerili","Japanese Exclusive Economic Zone",0,0,0.034024492572026,1.54968896910182
"Seriola dumerili","Jarvis Island Exclusive Economic Zone",0,0,0.00129622445763503,0.00559095575616745
"Seriola dumerili","Johnston Atoll Exclusive Economic Zone",0,0,0.00520989419236067,0.006141375256295
"Seriola dumerili","Joint regime area Australia / Papua New Guinea",0,0,0.000228926756376909,0.000791694648712711
"Seriola dumerili","Joint regime area Colombia / Jamaica",0,0,0.000133738682927479,0.000182418900792349
"Seriola dumerili","Joint regime area Ecuador / Colombia",0,0,0.00323784682011773,0.0115954633118312
"Seriola dumerili","Joint regime area Italy / France",0,0,1.4596688332376e-05,1.4596688332376e-05
"Seriola dumerili","Joint regime area Japan / Korea",0,0,0.00274237060627001,0.0317905819887731
"Seriola dumerili","Joint regime area Nigeria / Sao Tome and Principe",0,0,0.000237658767639859,0.000668271241830041
"Seriola dumerili","Joint regime area Peru / Ecuador",0,0,0.169041570617631,0.305100049994024
"Seriola dumerili","Joint regime area Senegal / Guinea Bissau",0,0,0.00133439692521553,0.00818435308575822
"Seriola dumerili","Juan de Nova Exclusive Economic Zone",0,0,8.47851953885453e-05,0.000228684708973349
"Seriola dumerili","Kenyan Exclusive Economic Zone",0,0,0.00015162356239322,0.000890273152080325
"Seriola dumerili","Kiribati Exclusive Economic Zone (Gilbert Islands)",0,0,0.00539375959416889,0.74912973882101
"Seriola dumerili","Kiribati Exclusive Economic Zone (Line Islands)",0,0,0.000265546759770911,0.00559095575616745
"Seriola dumerili","Kiribati Exclusive Economic Zone (Phoenix Islands)",0,0,0.000202931269578478,0.00238843389891467
"Seriola dumerili","Kuwaiti Exclusive Economic Zone",0,0,0.383720541744071,0.94907146676752
"Seriola dumerili","Lebanese Exclusive Economic Zone",0,0,0.00126229728647189,0.0025357409231609
"Seriola dumerili","Liberian Exclusive Economic Zone",0,0,0.00107990878345019,0.0290336220823314
"Seriola dumerili","Libyan Exclusive Economic Zone",0,0,0.00384151292321689,0.0307164435494839
"Seriola dumerili","Madagascan Exclusive Economic Zone",0,0,0.000475164452664386,0.0239754150680136
"Seriola dumerili","Malaysian Exclusive Economic Zone",0,0,0.00144949699731954,0.368219801266935
"Seriola dumerili","Maldives Exclusive Economic Zone",0,0,0.000463306209838328,0.00217901338416122
"Seriola dumerili","Maltese Exclusive Economic Zone",0,0,0.000811896860243251,0.0038848032949218
"Seriola dumerili","Marshall Islands Exclusive Economic Zone",0,0,0.000405557773496142,0.00749707159621883
"Seriola dumerili","Martinican Exclusive Economic Zone",0,0,6.98214614586732e-06,3.11037816218846e-05
"Seriola dumerili","Mauritanian Exclusive Economic Zone",0,0,0.402601051124462,1.18193446214429
"Seriola dumerili","Mauritian Exclusive Economic Zone",0,0,0.000209325784744979,0.0023921433099146
"Seriola dumerili","Mexican Exclusive Economic Zone",0,0,0.0224233762011151,1.3783983642575
"Seriola dumerili","Micronesian Exclusive Economic Zone",0,0,0.00156583595072381,0.0104132139995706
"Seriola dumerili","Monégasque Exclusive Economic Zone",0,0,0.00708727058596654,0.00945255382165239
"Seriola dumerili","Montenegrin Exclusive economic Zone",0,0,0.0120989826452217,0.0691394614449798
"Seriola dumerili","Montserrat Exclusive Economic Zone",0,0,6.53033849161147e-06,1.76516173234447e-05
"Seriola dumerili","Moroccan Exclusive Economic Zone",0,0,0.0131126406109955,0.201331803423505
"Seriola dumerili","Mozambican Exclusive Economic Zone",0,0,0.00172378656403902,0.116196607478765
"Seriola dumerili","Myanmar Exclusive Economic Zone",0,0,0.00283137560765516,0.055514669548453
"Seriola dumerili","Namibian Exclusive Economic Zone",0,0,0.323175257440254,0.890036175212838
"Seriola dumerili","Nauruan Exclusive Economic Zone",0,0,0.0015539549112195,0.00674762590918008
"Seriola dumerili","New Caledonian Exclusive Economic Zone",0,0,0.000184639695090648,0.00416525666201147
"Seriola dumerili","New Zealand Exclusive Economic Zone",0,0,0.0298591530153038,1.04053107761243
"Seriola dumerili","Nicaraguan Exclusive Economic Zone",0,0,0.00150366941248999,0.0722862517563258
"Seriola dumerili","Nigerian Exclusive Economic Zone",0,0,0.00864432827432044,0.116931734679369
"Seriola dumerili","Niue Exclusive Economic Zone",0,0,0.00161189891963752,0.00328827658907315
"Seriola dumerili","Norfolk Island Exclusive Economic Zone",0,0,3.75255855989659e-05,8.36770796597501e-05
"Seriola dumerili","North Korean Exclusive Economic Zone",0,0,0.04646635854496,0.370843293410268
"Seriola dumerili","Northern Mariana Exclusive Economic Zone",0,0,8.45253815782803e-05,0.000199220203839283
"Seriola dumerili","Oecussi Ambeno Exclusive Economic Zone",0,0,3.54545529421132e-05,4.46029807549665e-05
"Seriola dumerili","Omani Exclusive Economic Zone",0,0,0.0538458122785538,0.6571573126084
"Seriola dumerili","Overlapping claim Chafarinas Islands: Spain / Morocco",0,0,0.000986547511447259,0.000986547511447259
"Seriola dumerili","Overlapping claim Gibraltarian Exclusive Economic Zone",0,0,0.00804282013849923,0.0121044875325533
"Seriola dumerili","Overlapping claim Glorioso Islands: France / Madagascar",0,0,4.01255184412769e-05,0.000250050135376026
"Seriola dumerili","Overlapping claim Ile Tromelin: Reunion / Madagascar / Mauritus",0,0,0.000248561587721922,0.000293182666857222
"Seriola dumerili","Overlapping claim Liancourt Rocks: Japan / South Korea",0,0,0.00608411615775158,0.0177752387411279
"Seriola dumerili","Overlapping claim Matthew and Hunter Islands: New Caledonia / Vanuatu",0,0,0.000104062878734746,0.000263516742859845
"Seriola dumerili","Overlapping claim Mayotte: France / Comoros",0,0,6.42441746228857e-05,0.000307949826723582
"Seriola dumerili","Overlapping claim Melilla: Spain / Morocco",0,0,6.89994697808226e-05,6.89994697808226e-05
"Seriola dumerili","Overlapping claim Navassa Island: USA / Haiti / Jamaica",0,0,9.74274987955503e-06,3.32454645642139e-05
"Seriola dumerili","Overlapping claim Senkaku Islands: Japan / China / Taiwan",0,0,0.00147097742814212,0.0192562138019389
"Seriola dumerili","Overlapping claim South China Sea",0,0,0.000602931879257541,0.00563640674783724
"Seriola dumerili","Overlapping claim Western Saharan Exclusive Economic Zone",0,0,0.0892791370023226,1.18193446214429
"Seriola dumerili","Overlapping claim: Iran / United Arab Emirates",0,0,0.108712953612348,0.323948443057191
"Seriola dumerili","Overlapping claim: Kenya / Somalia",0,0,0.000109956572469868,0.000301331740475627
"Seriola dumerili","Overlapping claim: Puerto Rico / Dominican Republic",0,0,0.00012991270348729,0.000229096298683825
"Seriola dumerili","Pakistani Exclusive Economic Zone",0,0,0.00115983397070371,0.0638760777264448
"Seriola dumerili","Palau Exclusive Economic Zone",0,0,0.00124101629209344,0.00357733089998395
"Seriola dumerili","Palmyra Atoll Exclusive Economic Zone",0,0,2.02227536344123e-05,5.99441072481532e-05
"Seriola dumerili","Panamanian Exclusive Economic Zone",0,0,0.00202410339150452,0.0540748241410186
"Seriola dumerili","Papua New Guinean Exclusive Economic Zone",0,0,0.0004573346242344,0.102009863643238
"Seriola dumerili","Peruvian Exclusive Economic Zone",0,0,0.279235205932198,1.733940085486
"Seriola dumerili","Philippines Exclusive Economic Zone",0,0,0.00396888429028726,1.41728807674018
"Seriola dumerili","Portuguese Exclusive Economic Zone",0,0,0.0416954252991479,0.275165347647524
"Seriola dumerili","Portuguese Exclusive Economic Zone (Azores)",0,0,0.00982645123322821,0.086450434094592
"Seriola dumerili","Portuguese Exclusive Economic Zone (Madeira)",0,0,0.00371889500539097,0.0120517712216903
"Seriola dumerili","Puerto Rican Exclusive Economic Zone",0,0,7.69492577310198e-05,0.0009959336069031
"Seriola dumerili","Qatari Exclusive Economic Zone",0,0,0.242106214833498,0.467721686507316
"Seriola dumerili","Réunion Exclusive Economic Zone",0,0,0.000105786607388863,0.000371583604483292
"Seriola dumerili","Russian Exclusive economic Zone",0,0,0.108331463789762,0.677515559786184
"Seriola dumerili","Saba Exclusive Economic Zone",0,0,9.66533957876868e-06,3.67408434522836e-05
"Seriola dumerili","Saint Kitts and Nevis Exclusive Economic Zone",0,0,9.72662084275938e-06,3.41879764256086e-05
"Seriola dumerili","Saint Lucia Exclusive Economic Zone",0,0,3.30094427092351e-05,0.000170072351544318
"Seriola dumerili","Saint Vincent and the Grenadines Exclusive Economic Zone",0,0,3.78895557755148e-05,0.000170072351544318
"Seriola dumerili","Saint-Barthélemy Exclusive Economic Zone",0,0,4.77993559060928e-05,0.000152868572171189
"Seriola dumerili","Saint-Martin Exclusive Economic Zone",0,0,1.25952541874417e-05,2.45703942864415e-05
"Seriola dumerili","Samoan Exclusive Economic Zone",0,0,0.00347011141349508,0.0281500195646316
"Seriola dumerili","Sao Tome and Principe Exclusive Economic Zone",0,0,0.000330652990167733,0.00166765032264482
"Seriola dumerili","Saudi Arabian Exclusive Economic Zone",0,0,0.0275607419700065,0.94907146676752
"Seriola dumerili","Senegalese Exclusive Economic Zone",0,0,0.013881328462221,0.258808379506439
"Seriola dumerili","Seychellois Exclusive Economic Zone",0,0,2.61730880536817e-05,0.000307949826723582
"Seriola dumerili","Sierra Leonian Exclusive Economic Zone",0,0,0.00212632187196276,0.102516585650718
"Seriola dumerili","Sint-Eustatius Exclusive Economic Zone",0,0,6.9850482139139e-06,2.29449747432471e-05
"Seriola dumerili","Sint-Maarten Exclusive Economic Zone",0,0,3.17710712873759e-06,3.17710712873759e-06
"Seriola dumerili","Solomon Islands Exclusive Economic Zone",0,0,0.000674199045639951,0.00891420347664645
"Seriola dumerili","Somali Exclusive Economic Zone",0,0,0.00348361145060971,0.0707119578522097
"Seriola dumerili","South African Exclusive Economic Zone",0,0,0.00143678824610156,0.00347937986544803
"Seriola dumerili","South Korean Exclusive Economic Zone",0,0,0.0516901982923066,1.54968896910182
"Seriola dumerili","Spanish Exclusive Economic Zone",0,0,0.0203212554883846,0.911307929382573
"Seriola dumerili","Spanish Exclusive Economic Zone (Canary Islands)",0,0,0.0209013296244747,0.249400264999912
"Seriola dumerili","Sri Lankan Exclusive Economic Zone",0,0,0.0138514492504412,0.41082913646195
"Seriola dumerili","St. Helena Exclusive Economic Zone",0,0,0.00425669077044494,0.0298676981913168
"Seriola dumerili","Sudanese Exclusive Economic Zone",0,0,0.00313026843733122,0.0248516550363689
"Seriola dumerili","Surinamese Exclusive Economic Zone",0,0,0.000910093091259489,0.0127546858876403
"Seriola dumerili","Syrian Exclusive Economic Zone",0,0,0.0015642286401462,0.00324849769613069
"Seriola dumerili","Taiwanese Exclusive Economic Zone",0,0,0.00744349198110278,0.437926560187953
"Seriola dumerili","Tanzanian Exclusive Economic Zone",0,0,0.000178356733141633,0.00137853020430396
"Seriola dumerili","Thailand Exclusive Economic Zone",0,0,0.00234430816663728,0.055514669548453
"Seriola dumerili","Togolese Exclusive Economic Zone",0,0,0.00472298074678465,0.0177617900166584
"Seriola dumerili","Tokelau Exclusive Economic Zone",0,0,0.00771993164923314,0.0177468272772074
"Seriola dumerili","Tongan Exclusive Economic Zone",0,0,0.000161493740014839,0.00130044718595939
"Seriola dumerili","Trinidad and Tobago Exclusive Economic Zone",0,0,0.00118725520621253,0.0145900829125014
"Seriola dumerili","Tunisian Exclusive Economic Zone",0,0,0.00282114023449261,0.054344420165976
"Seriola dumerili","Turkish Exclusive Economic Zone",0,0,0.0215822833110879,0.204708081501846
"Seriola dumerili","Turks and Caicos Exclusive Economic Zone",0,0,0.000565251947930377,0.00281391422118788
"Seriola dumerili","Tuvaluan Exclusive Economic Zone",0,0,0.00770463583073683,1.27181817934634
"Seriola dumerili","United Arab Emirates Exclusive Economic Zone",0,0,0.132826814537741,0.467721686507316
"Seriola dumerili","United States Exclusive Economic Zone",0.00142382534409112,0,0.0368169836366937,2.5606968834097
"Seriola dumerili","United States Exclusive Economic Zone (Hawaii)",0,0,0.015692768619997,1.58779071028628
"Seriola dumerili","Vanuatu Exclusive Economic Zone",0,0,9.21387033144611e-05,0.00110868122458665
"Seriola dumerili","Venezuelan Exclusive Economic Zone",0,0,0.00144731547120342,0.0600391962071094
"Seriola dumerili","Vietnamese Exclusive Economic Zone",0,0,0.00699428266258319,0.742322228651148
"Seriola dumerili","Virgin Islander Exclusive Economic Zone",0,0,0.000104552553736853,0.0009959336069031
"Seriola dumerili","Wake Island Exclusive Economic Zone",0,0,0.00068439726312868,0.000811493755799781
"Seriola dumerili","Wallis and Futuna Exclusive Economic Zone",0,0,0.0132934089705257,1.27181817934634
"Seriola dumerili","Yemeni Exclusive Economic Zone",0,0,0.00568921766591324,0.280132555531685
