"Species","EEZ","p2","p4","Average","Max"
"Placopecten magellanicus","Canadian Exclusive Economic Zone",0.00903614457831325,0.00301204819277108,0.35372532191961,5.55744077394919
"Placopecten magellanicus","Chinese Exclusive Economic Zone",0.96,0.0690909090909091,2.97906245602259,5.17532118403656
"Placopecten magellanicus","Japanese Exclusive Economic Zone",0.157221206581353,0.00914076782449726,0.894267743251545,5.02252771307397
"Placopecten magellanicus","North Korean Exclusive Economic Zone",0.517441860465116,0.104651162790698,1.91159581635676,6.02026963870961
"Placopecten magellanicus","Overlapping claim Kuril Islands: Japan / Russia",0,0,0.491182251947375,1.53839554029802
"Placopecten magellanicus","Russian Exclusive economic Zone",0.0637931034482759,0.00172413793103448,0.636611769932036,4.01500497469083
"Placopecten magellanicus","Saint-Pierre and Miquelon Exclusive Economic Zone",0,0,0.221538410557849,1.08851853903689
"Placopecten magellanicus","South Korean Exclusive Economic Zone",0.822299651567944,0.0801393728222996,2.56805258865555,6.02026963870961
"Placopecten magellanicus","United States Exclusive Economic Zone",0.187296416938111,0.115635179153094,1.22168387442011,8.2923610758136
