"Species","EEZ","p2","p4","Average","Max"
"Scylla serrata","American Samoa Exclusive Economic Zone",0,0,1.69928250871372,1.8431108109806
"Scylla serrata","Australian Exclusive Economic Zone",0.0158054711246201,0,0.40051432754567,2.91520951176074
"Scylla serrata","Bangladeshi Exclusive Economic Zone",0.08,0,0.837655253730848,3.4973771732037
"Scylla serrata","Bassas da India Exclusive Economic Zone",0,0,0.126640041388785,0.223005540255795
"Scylla serrata","Bruneian Exclusive Economic Zone",0,0,0.284353289698195,1.66437285341251
"Scylla serrata","Cambodian Exclusive Economic Zone",0,0,0.372343793050363,0.902483901023151
"Scylla serrata","Chagos Archipelago Exclusive Economic Zone",0,0,1.30613568162178,1.70030983106823
"Scylla serrata","Chinese Exclusive Economic Zone",0.0128504672897196,0.0058411214953271,0.374317690500678,5.97555033312973
"Scylla serrata","Christmas Island Exclusive Economic Zone",0,0,0.152713907783577,0.196262850532725
"Scylla serrata","Cocos Islands Exclusive Economic Zone",0,0,0.517202458886851,0.747833921998915
"Scylla serrata","Comoran Exclusive Economic Zone",0,0,0.104861575750115,0.178234969819448
"Scylla serrata","Cook Islands Exclusive Economic Zone",0,0,0.824761600435787,1.95478111970856
"Scylla serrata","Djiboutian Exclusive Economic Zone",1,1,5.95220007750902,6.79587037579059
"Scylla serrata","East Timorian Exclusive Economic Zone",0,0,0.580484915637825,0.977327345541635
"Scylla serrata","Eritrean Exclusive Economic Zone",1,1,7.99004041129124,8.2923610758136
"Scylla serrata","Fijian Exclusive Economic Zone",0.0174158625558955,0,0.375768780257339,2.91520951176074
"Scylla serrata","French Polynesian Exclusive Economic Zone",0,0,0.811848298098007,1.35451858936304
"Scylla serrata","Howland and Baker Islands Exclusive Economic Zone",1,0,2.28807111286359,2.43777478130636
"Scylla serrata","Ile Europa Exclusive Economic Zone",0,0,0.126640041388785,0.223005540255795
"Scylla serrata","Indian Exclusive Economic Zone",0.468789808917197,0,1.63071353485382,3.6547018138731
"Scylla serrata","Indian Exclusive Economic Zone (Andaman and Nicobar Islands)",0,0,0.27440552448349,1.21501307677414
"Scylla serrata","Indonesian Exclusive Economic Zone",0.0919922901699667,0.00665848957420711,0.729176873311362,5.76901721570895
"Scylla serrata","Iranian Exclusive Economic Zone",1,0.833333333333333,5.33864621541147,6.74475002002958
"Scylla serrata","Japanese Exclusive Economic Zone",0.0323275862068966,0,0.42416589530105,3.39566389523901
"Scylla serrata","Jarvis Island Exclusive Economic Zone",0,0,0.474280288549115,1.26067566999883
"Scylla serrata","Joint regime area Australia / Papua New Guinea",0,0,0.0624331272077383,0.154842347006125
"Scylla serrata","Joint regime area Japan / Korea",0,0,0.322287948474921,0.917249434467379
"Scylla serrata","Juan de Nova Exclusive Economic Zone",0,0,0.0372051222446916,0.0783008748545941
"Scylla serrata","Kenyan Exclusive Economic Zone",0,0,0.177471683035617,0.440205104102074
"Scylla serrata","Kiribati Exclusive Economic Zone (Gilbert Islands)",0.208220822082208,0.0108010801080108,1.14768323333515,5.76901721570895
"Scylla serrata","Kiribati Exclusive Economic Zone (Line Islands)",0,0,0.402291121585351,1.26067566999883
"Scylla serrata","Kiribati Exclusive Economic Zone (Phoenix Islands)",0.121951219512195,0,0.583359880019286,2.43777478130636
"Scylla serrata","Madagascan Exclusive Economic Zone",0.00757575757575758,0,0.180348845013458,2.87432164661862
"Scylla serrata","Malaysian Exclusive Economic Zone",0.0293855743544078,0,0.500124128568242,3.90610117964423
"Scylla serrata","Maldives Exclusive Economic Zone",0.764150943396226,0,2.15575600343914,2.6401141666951
"Scylla serrata","Marshall Islands Exclusive Economic Zone",0.152380952380952,0,1.37936575165176,2.55404761667045
"Scylla serrata","Mauritian Exclusive Economic Zone",0,0,0.173124062161806,0.634479672584425
"Scylla serrata","Micronesian Exclusive Economic Zone",0.505154639175258,0,1.99110617186271,2.97327097888846
"Scylla serrata","Mozambican Exclusive Economic Zone",0,0,0.123691444275613,1.44025184776069
"Scylla serrata","Myanmar Exclusive Economic Zone",0,0,0.489099377214713,1.67425566735339
"Scylla serrata","Nauruan Exclusive Economic Zone",1,0,2.49670285300003,2.79922565063631
"Scylla serrata","New Caledonian Exclusive Economic Zone",0,0,0.0760754193950157,0.514718184994079
"Scylla serrata","New Zealand Exclusive Economic Zone",0.0025,0,0.0972789967042662,2.16669395622552
"Scylla serrata","Oecussi Ambeno Exclusive Economic Zone",0,0,0.0204338185085249,0.0267731396086013
"Scylla serrata","Omani Exclusive Economic Zone",0.433333333333333,0.366666666666667,2.50261695547931,6.74475002002958
"Scylla serrata","Overlapping claim Glorioso Islands: France / Madagascar",0,0,0.0972334951075968,0.213557989722688
"Scylla serrata","Overlapping claim Matthew and Hunter Islands: New Caledonia / Vanuatu",0,0,0.0165222801362518,0.0786448081764512
"Scylla serrata","Overlapping claim Mayotte: France / Comoros",0,0,0.095967901356072,0.178234969819448
"Scylla serrata","Overlapping claim Senkaku Islands: Japan / China / Taiwan",0,0,0.243032210513606,0.560920660812616
"Scylla serrata","Overlapping claim South China Sea",0.00268096514745308,0,0.26619012800675,2.37023176917751
"Scylla serrata","Overlapping claim: Kenya / Somalia",0,0,0.180333819190291,0.239129369939373
"Scylla serrata","Pakistani Exclusive Economic Zone",0.333333333333333,0,1.32291446058434,3.03574017255522
"Scylla serrata","Palau Exclusive Economic Zone",0,0,1.33449960338258,1.50091676505881
"Scylla serrata","Palmyra Atoll Exclusive Economic Zone",0,0,0.407312605160402,0.494886926696207
"Scylla serrata","Papua New Guinean Exclusive Economic Zone",0.0946822308690013,0,1.02704231820698,3.80633574065799
"Scylla serrata","Philippines Exclusive Economic Zone",0.0811897106109325,0.00321543408360129,0.965742968173161,5.92927978975122
"Scylla serrata","Réunion Exclusive Economic Zone",0,0,0.117975810907286,0.158754898655473
"Scylla serrata","Samoan Exclusive Economic Zone",0,0,1.69928250871372,1.8431108109806
"Scylla serrata","Saudi Arabian Exclusive Economic Zone",1,1,8.2923610758136,8.2923610758136
"Scylla serrata","Seychellois Exclusive Economic Zone",0,0,0.455755400456056,1.25015531142259
"Scylla serrata","Solomon Islands Exclusive Economic Zone",0.28428927680798,0,1.66437698512725,2.44282972417647
"Scylla serrata","Somali Exclusive Economic Zone",0.396103896103896,0.224025974025974,1.8357219309834,6.79587037579059
"Scylla serrata","South African Exclusive Economic Zone",0.0102040816326531,0,0.326662830617458,2.16669395622552
"Scylla serrata","South Korean Exclusive Economic Zone",0,0,0.433771910435216,1.28763064264374
"Scylla serrata","Sri Lankan Exclusive Economic Zone",0.257668711656442,0,1.19628048802407,3.6547018138731
"Scylla serrata","Taiwanese Exclusive Economic Zone",0.00985221674876847,0,0.250573914634613,2.58914758391097
"Scylla serrata","Tanzanian Exclusive Economic Zone",0,0,0.111019638812952,0.620398662449703
"Scylla serrata","Thailand Exclusive Economic Zone",0.0157068062827225,0,0.501013602826388,2.89052160911314
"Scylla serrata","Tongan Exclusive Economic Zone",0,0,0.164801977936667,0.590827873309548
"Scylla serrata","Tuvaluan Exclusive Economic Zone",0.0353309481216458,0,0.587285901516001,3.80633574065799
"Scylla serrata","United Arab Emirates Exclusive Economic Zone",1,1,6.3434268040932,6.34724064749839
"Scylla serrata","United States Exclusive Economic Zone (Hawaii)",0.0941730429664508,0.0176574455562095,0.68098986876908,8.2923610758136
"Scylla serrata","Vanuatu Exclusive Economic Zone",0,0,0.0996771644452188,0.514718184994079
"Scylla serrata","Vietnamese Exclusive Economic Zone",0.0228310502283105,0.0114155251141553,0.40687117130872,6.16100898236976
"Scylla serrata","Wallis and Futuna Exclusive Economic Zone",0.0256645279560037,0,0.508105269149834,2.87432164661862
"Scylla serrata","Yemeni Exclusive Economic Zone",0.554054054054054,0.328828828828829,2.60060429725173,8.2923610758136
