"Species","EEZ","p2","p4","Average","Max"
"Caranx sexfasciatus","American Samoa Exclusive Economic Zone",0,0,1.00076558067749,1.77590319023581
"Caranx sexfasciatus","Australian Exclusive Economic Zone",0.0120647107211407,0,0.317875949735078,2.91402168743028
"Caranx sexfasciatus","Bahraini Exclusive Economic Zone",1,0.473684210526316,3.88561213203075,4.94189190357818
"Caranx sexfasciatus","Bangladeshi Exclusive Economic Zone",0.0655737704918033,0.0491803278688525,0.444603292746288,8.2923610758136
"Caranx sexfasciatus","Bassas da India Exclusive Economic Zone",0,0,0.0247274685747117,0.0359293526164124
"Caranx sexfasciatus","Bruneian Exclusive Economic Zone",0,0,0.261987125701721,1.59973376471165
"Caranx sexfasciatus","Cambodian Exclusive Economic Zone",0,0,0.327247771331636,0.708739649655842
"Caranx sexfasciatus","Chagos Archipelago Exclusive Economic Zone",0,0,0.776164234604905,1.29024416722114
"Caranx sexfasciatus","Chilean Exclusive Economic Zone",0.0514705882352941,0,0.878367481215635,3.06530933729178
"Caranx sexfasciatus","Chilean Exclusive Economic Zone (Easter Island)",0,0,0.00135928905308911,0.00149655615177855
"Caranx sexfasciatus","Chilean Exclusive Economic Zone (San Felix and San Ambrosio islands)",0,0,0.171984427721374,0.202478292721692
"Caranx sexfasciatus","Chinese Exclusive Economic Zone",0.0132916340891321,0.00390930414386239,0.192630219471726,6.34482983123757
"Caranx sexfasciatus","Clipperton Exclusive Economic Zone",0,0,0.00413178567260674,0.00486705693405306
"Caranx sexfasciatus","Cocos Islands Exclusive Economic Zone",0,0,0.0320025101964119,0.0555306537308502
"Caranx sexfasciatus","Colombian Exclusive Economic Zone",0,0,0.0543520129460401,0.915141239235061
"Caranx sexfasciatus","Comoran Exclusive Economic Zone",0,0,0.0366423964542617,0.060262039552904
"Caranx sexfasciatus","Cook Islands Exclusive Economic Zone",0,0,0.371680103723507,1.61033398049169
"Caranx sexfasciatus","Costa Rican Exclusive Economic Zone",0,0,0.0387032525595103,0.3447059555591
"Caranx sexfasciatus","Djiboutian Exclusive Economic Zone",1,1,5.85481972381063,6.80207939794405
"Caranx sexfasciatus","East Timorian Exclusive Economic Zone",0,0,0.583406785803451,0.975730213687422
"Caranx sexfasciatus","Ecuadorian Exclusive Economic Zone",0.0131578947368421,0,0.0981610803377622,2.23119231968793
"Caranx sexfasciatus","Ecuadorian Exclusive Economic Zone (Galapagos)",0.00943396226415094,0,0.128732222334127,2.02232495494765
"Caranx sexfasciatus","Egyptian Exclusive Economic Zone",0.545454545454545,0.236363636363636,2.37490492939377,5.69292145138238
"Caranx sexfasciatus","El Salvador Exclusive Economic Zone",0,0,0.0660293836552262,0.618789162310731
"Caranx sexfasciatus","Eritrean Exclusive Economic Zone",1,1,8.13979830263874,8.2923610758136
"Caranx sexfasciatus","Fijian Exclusive Economic Zone",0.0248233063264954,0.00430960179279435,0.330426046708981,8.2923610758136
"Caranx sexfasciatus","French Polynesian Exclusive Economic Zone",0,0,0.039550921572576,0.210781495943692
"Caranx sexfasciatus","Guam Exclusive Economic Zone",0,0,0.714180971736948,0.781427510048014
"Caranx sexfasciatus","Guatemalan Exclusive Economic Zone",0,0,0.0834171159044769,0.618779844425245
"Caranx sexfasciatus","Honduran Exclusive Economic Zone",0,0,0.435228926325693,0.618789162310731
"Caranx sexfasciatus","Ile Europa Exclusive Economic Zone",0,0,0.0268120124115974,0.0359293526164124
"Caranx sexfasciatus","Indian Exclusive Economic Zone",0.354124748490946,0,1.33849374593268,3.65369600628732
"Caranx sexfasciatus","Indian Exclusive Economic Zone (Andaman and Nicobar Islands)",0,0,0.197688994906522,1.92325318287805
"Caranx sexfasciatus","Indonesian Exclusive Economic Zone",0.0528789659224442,0.00151082759778412,0.573966271179834,4.69500339439321
"Caranx sexfasciatus","Iranian Exclusive Economic Zone",0.969620253164557,0.706329113924051,5.29174971362336,8.2923610758136
"Caranx sexfasciatus","Iraqi Exclusive Economic Zone",1,0.333333333333333,3.69144067140676,4.10851424674773
"Caranx sexfasciatus","Japanese Exclusive Economic Zone",0,0,0.149152644797994,1.57434102585124
"Caranx sexfasciatus","Jarvis Island Exclusive Economic Zone",0,0,0.0668125342256213,0.079706191691483
"Caranx sexfasciatus","Joint regime area Australia / Papua New Guinea",0,0,0.0254867972359499,0.0570295920284073
"Caranx sexfasciatus","Joint regime area Ecuador / Colombia",0,0,0.0135204710146027,0.0426394345324818
"Caranx sexfasciatus","Joint regime area Japan / Korea",0,0,0.0968953234954155,1.51271914392072
"Caranx sexfasciatus","Joint regime area Peru / Ecuador",0,0,0.122487667647517,0.284049523020468
"Caranx sexfasciatus","Juan de Nova Exclusive Economic Zone",0,0,0.0260495259587648,0.0324948645062151
"Caranx sexfasciatus","Kenyan Exclusive Economic Zone",0,0,0.0041205204133049,0.0137342878830618
"Caranx sexfasciatus","Kiribati Exclusive Economic Zone (Gilbert Islands)",0.132403189066059,0.0025626423690205,0.870025245988582,4.69500339439321
"Caranx sexfasciatus","Kiribati Exclusive Economic Zone (Line Islands)",0,0,0.236806578744584,1.61033398049169
"Caranx sexfasciatus","Kiribati Exclusive Economic Zone (Phoenix Islands)",0,0,0.149613282047397,0.162539461231354
"Caranx sexfasciatus","Kuwaiti Exclusive Economic Zone",0.652173913043478,0.0434782608695652,2.35538274243058,4.10851424674773
"Caranx sexfasciatus","Madagascan Exclusive Economic Zone",0.0017636684303351,0,0.0798933309258212,2.19852573350003
"Caranx sexfasciatus","Malaysian Exclusive Economic Zone",0.0092899800928998,0,0.348126803786934,3.48045621631494
"Caranx sexfasciatus","Maldives Exclusive Economic Zone",0.594470046082949,0,1.83761416679792,2.42352046196922
"Caranx sexfasciatus","Marshall Islands Exclusive Economic Zone",0.0369127516778524,0,0.674365855251807,2.30708512397721
"Caranx sexfasciatus","Mauritian Exclusive Economic Zone",0,0,0.0513986609133767,0.185153028008122
"Caranx sexfasciatus","Mexican Exclusive Economic Zone",0.00422535211267606,0,0.187730339801153,3.49213900506725
"Caranx sexfasciatus","Micronesian Exclusive Economic Zone",0.101654846335697,0,1.35562468874695,2.58170821859323
"Caranx sexfasciatus","Mozambican Exclusive Economic Zone",0,0,0.0450383540162116,1.23720251342627
"Caranx sexfasciatus","Myanmar Exclusive Economic Zone",0.00849256900212314,0,0.165534387266683,3.99499497328833
"Caranx sexfasciatus","Nauruan Exclusive Economic Zone",1,0,2.22385884603485,2.30708512397721
"Caranx sexfasciatus","New Caledonian Exclusive Economic Zone",0,0,0.0245509450249173,0.147608623676713
"Caranx sexfasciatus","New Zealand Exclusive Economic Zone",0,0,0.103512618156667,1.72224170999331
"Caranx sexfasciatus","Nicaraguan Exclusive Economic Zone",0,0,0.0933281843057141,0.618789162310731
"Caranx sexfasciatus","Niue Exclusive Economic Zone",0,0,0.0241190050088943,0.0269597038092054
"Caranx sexfasciatus","Norfolk Island Exclusive Economic Zone",0,0,0.0270433148747743,0.103182987665676
"Caranx sexfasciatus","Northern Mariana Exclusive Economic Zone",0,0,0.521901123313977,0.781427510048014
"Caranx sexfasciatus","Oecussi Ambeno Exclusive Economic Zone",0,0,0.0204784908281063,0.026364546118888
"Caranx sexfasciatus","Omani Exclusive Economic Zone",0.727586206896552,0.603448275862069,4.52311635615416,8.2923610758136
"Caranx sexfasciatus","Overlapping claim Glorioso Islands: France / Madagascar",0,0,0.0378202551617829,0.0783653420898726
"Caranx sexfasciatus","Overlapping claim Matthew and Hunter Islands: New Caledonia / Vanuatu",0,0,0.0167408373560548,0.0775412279337047
"Caranx sexfasciatus","Overlapping claim Mayotte: France / Comoros",0,0,0.0381929161837059,0.060262039552904
"Caranx sexfasciatus","Overlapping claim Qatar / Saudi Arabia / United Arab Emirates",1,1,6.61396745146579,6.61396745146579
"Caranx sexfasciatus","Overlapping claim Senkaku Islands: Japan / China / Taiwan",0,0,0.0499281020285551,0.21275367830721
"Caranx sexfasciatus","Overlapping claim South China Sea",0.00226244343891403,0,0.205931225417007,2.06804796266841
"Caranx sexfasciatus","Overlapping claim: Iran / United Arab Emirates",1,1,8.018233808207,8.2923610758136
"Caranx sexfasciatus","Overlapping claim: Kenya / Somalia",0,0,0.00708740527568788,0.0123141356115995
"Caranx sexfasciatus","Overlapping claim: Sudan / Egypt",1,1,6.46379781612374,7.24166759548821
"Caranx sexfasciatus","Pakistani Exclusive Economic Zone",0.211382113821138,0,1.12312096020507,2.67862081573276
"Caranx sexfasciatus","Palau Exclusive Economic Zone",0,0,0.857497681504647,1.14934923698298
"Caranx sexfasciatus","Palmyra Atoll Exclusive Economic Zone",0,0,0.121077418466896,0.137208732943449
"Caranx sexfasciatus","Panamanian Exclusive Economic Zone",0,0,0.0544306478395262,0.915141239235061
"Caranx sexfasciatus","Papua New Guinean Exclusive Economic Zone",0.0446635730858469,0,0.767910014491421,2.9114906164902
"Caranx sexfasciatus","Peruvian Exclusive Economic Zone",0.585227272727273,0.357954545454545,3.49453623304153,8.2923610758136
"Caranx sexfasciatus","Philippines Exclusive Economic Zone",0.0454858718125431,0.00137835975189524,0.753093537391937,6.34482983123757
"Caranx sexfasciatus","Pitcairn Islands Exclusive Economic Zone",0,0,0.00782967708973068,0.0127002113223087
"Caranx sexfasciatus","Qatari Exclusive Economic Zone",1,0.8625,5.26539415603916,7.31788499060152
"Caranx sexfasciatus","Réunion Exclusive Economic Zone",0,0,0.0833917966018858,0.185153028008122
"Caranx sexfasciatus","Samoan Exclusive Economic Zone",0,0,0.872829208035316,1.77590319023581
"Caranx sexfasciatus","Saudi Arabian Exclusive Economic Zone",0.974137931034483,0.59051724137931,5.21159227677522,8.2923610758136
"Caranx sexfasciatus","Seychellois Exclusive Economic Zone",0,0,0.353526281059387,0.995647023319828
"Caranx sexfasciatus","Solomon Islands Exclusive Economic Zone",0.0366795366795367,0,1.17736043106454,2.14418723507507
"Caranx sexfasciatus","Somali Exclusive Economic Zone",0.358839050131926,0.224274406332454,1.7842159903513,8.12589066470191
"Caranx sexfasciatus","South African Exclusive Economic Zone",0,0,0.154035472646466,1.49930165674417
"Caranx sexfasciatus","Sri Lankan Exclusive Economic Zone",0.186170212765957,0,1.07586106298086,3.65369600628732
"Caranx sexfasciatus","Sudanese Exclusive Economic Zone",1,1,7.68244680320797,8.2923610758136
"Caranx sexfasciatus","Taiwanese Exclusive Economic Zone",0.00558659217877095,0,0.134738752938713,2.4134870268681
"Caranx sexfasciatus","Tanzanian Exclusive Economic Zone",0,0,0.0148827630401678,0.292139932741699
"Caranx sexfasciatus","Thailand Exclusive Economic Zone",0,0,0.236077695662561,1.49785042902596
"Caranx sexfasciatus","Tokelau Exclusive Economic Zone",0.833333333333333,0,2.09617356896071,2.2460918375538
"Caranx sexfasciatus","Tongan Exclusive Economic Zone",0,0,0.0890817453795366,0.878301592344308
"Caranx sexfasciatus","Tuvaluan Exclusive Economic Zone",0.0322128851540616,0.0114045618247299,0.561808110431048,8.2923610758136
"Caranx sexfasciatus","United Arab Emirates Exclusive Economic Zone",1,1,6.76730334185388,8.2923610758136
"Caranx sexfasciatus","United States Exclusive Economic Zone",0,0,0.135553894459316,1.77267831909461
"Caranx sexfasciatus","United States Exclusive Economic Zone (Hawaii)",0.181117021276596,0.109574468085106,1.1041392401906,8.2923610758136
"Caranx sexfasciatus","Vanuatu Exclusive Economic Zone",0,0,0.0798068421964891,1.31909591871164
"Caranx sexfasciatus","Vietnamese Exclusive Economic Zone",0.0174537987679671,0.00924024640657084,0.185107103288291,7.07341368437844
"Caranx sexfasciatus","Wallis and Futuna Exclusive Economic Zone",0.0368952314653672,0.00870170553428472,0.505788057998201,8.2923610758136
"Caranx sexfasciatus","Yemeni Exclusive Economic Zone",0.513513513513513,0.372972972972973,3.04388840909865,8.2923610758136
