"Species","EEZ","p2","p4","Average","Max"
"Megalops atlanticus","Angolan Exclusive Economic Zone",0,0,0.107436261844246,0.788901977512259
"Megalops atlanticus","Anguilla Exclusive Economic Zone",0,0,4.27515795193172e-05,0.000152836210687703
"Megalops atlanticus","Antigua and Barbuda Exclusive Economic Zone",0,0,2.27997293424164e-05,0.000152836210687703
"Megalops atlanticus","Argentinean Exclusive Economic Zone",0,0,0.0575505315707144,0.659981913497577
"Megalops atlanticus","Aruban Exclusive Economic Zone",0,0,0.000100607517193369,0.000738354537931957
"Megalops atlanticus","Ascension Exclusive Economic Zone",0,0,0.000267384641630664,0.000569528354185438
"Megalops atlanticus","Bahamas Exclusive Economic Zone",0,0,0.00521221769143921,0.163720190297668
"Megalops atlanticus","Barbados Exclusive Economic Zone",0,0,0.00018502960576659,0.00165650404859071
"Megalops atlanticus","Belizean Exclusive Economic Zone",0,0,0.0110081156878249,0.106030881766885
"Megalops atlanticus","Beninese Exclusive Economic Zone",0,0,0.0147501014131767,0.0643359433950995
"Megalops atlanticus","Bermudian Exclusive Economic Zone",0,0,0.0138778998111661,0.0415017077205606
"Megalops atlanticus","Bonaire Exclusive Economic Zone",0,0,6.55078751855692e-05,0.000199091355298167
"Megalops atlanticus","Brazilian Exclusive Economic Zone",0,0,0.0328777118605152,0.72949337156741
"Megalops atlanticus","British Virgin Islands Exclusive Economic Zone",0,0,0.000184125095166725,0.000995912916677121
"Megalops atlanticus","Cameroonian Exclusive Economic Zone",0,0,0.0314210981384196,0.258681275124492
"Megalops atlanticus","Canadian Exclusive Economic Zone",0.0555555555555556,0,0.4871201241998,2.99735409865374
"Megalops atlanticus","Cape Verdean Exclusive Economic Zone",0,0,0.0590271564183084,0.283107042870335
"Megalops atlanticus","Cayman Islands Exclusive Economic Zone",0,0,0.00762057501932555,0.0123806423321381
"Megalops atlanticus","Colombian Exclusive Economic Zone",0,0,0.0247375652465598,0.627609761099479
"Megalops atlanticus","Colombian Exclusive Economic Zone (Bajo Nuevo)",0,0,0.000210051635209376,0.000210051635209376
"Megalops atlanticus","Colombian Exclusive Economic Zone (Quitasueño)",0,0,0.00135076350769931,0.00160956476479178
"Megalops atlanticus","Colombian Exclusive Economic Zone (Serrana)",0,0,0.00056825619696717,0.000829172265281799
"Megalops atlanticus","Colombian Exclusive Economic Zone (Serranilla)",0,0,0.000329775248206472,0.000366678948977346
"Megalops atlanticus","Congolese Exclusive Economic Zone",0,0,0.0151938923198795,0.0198901285629564
"Megalops atlanticus","Costa Rican Exclusive Economic Zone",0,0,0.00295451076489683,0.0546340963595746
"Megalops atlanticus","Cuban Exclusive Economic Zone",0,0,0.00974573641186374,0.278604421055119
"Megalops atlanticus","Curaçaoan Exclusive Economic Zone",0,0,5.9162526809661e-05,0.00015466283091395
"Megalops atlanticus","Democratic Republic of the Congo Exclusive Economic Zone",0,0,0.222279981018833,0.788901977512259
"Megalops atlanticus","Dominican Exclusive Economic Zone",0,0,2.97177804584748e-05,0.000287289777817657
"Megalops atlanticus","Dominican Republic Exclusive Economic Zone",0,0,0.000366252132010381,0.00305479050043269
"Megalops atlanticus","Equatorial Guinean Exclusive Economic Zone",0,0,0.0119092060739729,0.258681275124492
"Megalops atlanticus","French Exclusive Economic Zone",0,0,0.0205209708823033,0.0836571900663446
"Megalops atlanticus","French Guiana Exclusive Economic Zone",0,0,0.00238054328063317,0.13245946122037
"Megalops atlanticus","Gabonese Exclusive Economic Zone",0,0,0.0094972675028522,0.0859621023366742
"Megalops atlanticus","Gambian Exclusive Economic Zone",0,0,0.0676037157211476,0.374853443376035
"Megalops atlanticus","Ghanaian Exclusive Economic Zone",0,0,0.0271796518904345,0.28140179015841
"Megalops atlanticus","Grenadian Exclusive Economic Zone",0,0,0.000806255330767163,0.00288186885223806
"Megalops atlanticus","Guadeloupean Exclusive Economic Zone",0,0,2.57643154016361e-05,0.000287289777817657
"Megalops atlanticus","Guatemalan Exclusive Economic Zone",0,0,0.188943675307206,0.333507812421205
"Megalops atlanticus","Guinea Bissau Exclusive Economic Zone",0,0,0.0130192687449827,0.206295165288185
"Megalops atlanticus","Guinean Exclusive Economic Zone",0,0,0.00507240499757312,0.0800055772639284
"Megalops atlanticus","Guyanese Exclusive Economic Zone",0,0,0.00728313253681856,0.173816208172293
"Megalops atlanticus","Haitian Exclusive Economic Zone",0,0,0.000180510724727286,0.00240463017867136
"Megalops atlanticus","Honduran Exclusive Economic Zone",0,0,0.0172327666892874,0.102875028721765
"Megalops atlanticus","Ivory Coast Exclusive Economic Zone",0,0,0.0366722136728491,0.322724262406349
"Megalops atlanticus","Jamaican Exclusive Economic Zone",0,0,0.00196286328478701,0.0119300696617139
"Megalops atlanticus","Joint regime area Argentina / Uruguay",0,0,0.0876496791457915,0.425476270172077
"Megalops atlanticus","Joint regime area Colombia / Jamaica",0,0,0.00026847721557392,0.000392938885185009
"Megalops atlanticus","Joint regime area Nigeria / Sao Tome and Principe",0,0,0.000635430727991838,0.0015053651038531
"Megalops atlanticus","Joint regime area Senegal / Guinea Bissau",0,0,0.00659499392731183,0.017330732862568
"Megalops atlanticus","Liberian Exclusive Economic Zone",0,0,0.00361451014227928,0.0586132609426706
"Megalops atlanticus","Martinican Exclusive Economic Zone",0,0,2.7428300009405e-05,0.000287289777817657
"Megalops atlanticus","Mauritanian Exclusive Economic Zone",0,0,0.599784668025297,1.14141091682296
"Megalops atlanticus","Mexican Exclusive Economic Zone",0,0,0.0065680907226252,0.333507812421205
"Megalops atlanticus","Montserrat Exclusive Economic Zone",0,0,2.01296485275624e-05,7.32914564134111e-05
"Megalops atlanticus","Moroccan Exclusive Economic Zone",0,0,0.0233614933500063,0.313029839744786
"Megalops atlanticus","Namibian Exclusive Economic Zone",0,0,0.266070079702905,0.762938760909472
"Megalops atlanticus","Nicaraguan Exclusive Economic Zone",0,0,0.0170396256324485,0.333507812421205
"Megalops atlanticus","Nigerian Exclusive Economic Zone",0,0,0.0218353061996628,0.183837529054769
"Megalops atlanticus","Overlapping claim Gibraltarian Exclusive Economic Zone",0,0,0.00398343011836558,0.00398343011836558
"Megalops atlanticus","Overlapping claim Navassa Island: USA / Haiti / Jamaica",0,0,1.28873220332066e-06,1.76572483272535e-06
"Megalops atlanticus","Overlapping claim Western Saharan Exclusive Economic Zone",0,0,0.127833750097173,1.14141091682296
"Megalops atlanticus","Overlapping claim: Puerto Rico / Dominican Republic",0,0,0.00011468564059066,0.000238362936269851
"Megalops atlanticus","Panamanian Exclusive Economic Zone",0,0,0.00700853920251667,0.259350922014027
"Megalops atlanticus","Portuguese Exclusive Economic Zone",0,0,0.0907612987635429,0.343378599639288
"Megalops atlanticus","Portuguese Exclusive Economic Zone (Azores)",0,0,0.0165811828719387,0.128815892262585
"Megalops atlanticus","Portuguese Exclusive Economic Zone (Madeira)",0,0,0.00514324386133268,0.0131150920435141
"Megalops atlanticus","Puerto Rican Exclusive Economic Zone",0,0,0.000141810102480328,0.000995912916677121
"Megalops atlanticus","Saba Exclusive Economic Zone",0,0,3.05689799592402e-05,8.13121853940304e-05
"Megalops atlanticus","Saint Kitts and Nevis Exclusive Economic Zone",0,0,2.04888568469595e-05,8.13121853940304e-05
"Megalops atlanticus","Saint Lucia Exclusive Economic Zone",0,0,0.000623498809900766,0.00178053214685808
"Megalops atlanticus","Saint Vincent and the Grenadines Exclusive Economic Zone",0,0,0.000615034927202781,0.00178053214685808
"Megalops atlanticus","Saint-Barthélemy Exclusive Economic Zone",0,0,4.80530858587138e-05,0.000152836210687703
"Megalops atlanticus","Saint-Martin Exclusive Economic Zone",0,0,1.56334668009886e-05,3.57859895582712e-05
"Megalops atlanticus","Sao Tome and Principe Exclusive Economic Zone",0,0,0.00153854095404734,0.00754706941960429
"Megalops atlanticus","Senegalese Exclusive Economic Zone",0,0,0.0569089792019545,0.686756331969903
"Megalops atlanticus","Sierra Leonian Exclusive Economic Zone",0,0,0.00759387388231007,0.254285964837287
"Megalops atlanticus","Sint-Eustatius Exclusive Economic Zone",0,0,2.23395827917341e-05,8.13121853940304e-05
"Megalops atlanticus","Sint-Maarten Exclusive Economic Zone",0,0,3.17604332508484e-06,3.17604332508484e-06
"Megalops atlanticus","Spanish Exclusive Economic Zone",0,0,0.03855317094637,0.343378599639288
"Megalops atlanticus","Spanish Exclusive Economic Zone (Canary Islands)",0,0,0.0286712275694555,0.399874589836626
"Megalops atlanticus","St. Helena Exclusive Economic Zone",0,0,0.0298299616800978,0.158408809424829
"Megalops atlanticus","Surinamese Exclusive Economic Zone",0,0,0.00134408215671193,0.0127567285230619
"Megalops atlanticus","Togolese Exclusive Economic Zone",0,0,0.0169403345861589,0.0643359433950995
"Megalops atlanticus","Trinidad and Tobago Exclusive Economic Zone",0,0,0.00571232346205875,0.0342179221661
"Megalops atlanticus","Tristan Da Cunha Exclusive Economic Zone",0,0,0.0440701449530331,0.199990974511324
"Megalops atlanticus","Turks and Caicos Exclusive Economic Zone",0,0,0.000883750935229381,0.00281391925963447
"Megalops atlanticus","United States Exclusive Economic Zone",0.0029585798816568,0,0.0657371799836137,2.43649513554525
"Megalops atlanticus","Uruguayan Exclusive Economic Zone",0,0,0.101705108341756,0.659981913497577
"Megalops atlanticus","Venezuelan Exclusive Economic Zone",0,0,0.00689801757974793,0.309666704348164
"Megalops atlanticus","Virgin Islander Exclusive Economic Zone",0,0,0.000139815181805243,0.000995912916677121
