"Species","EEZ","p2","p4","Average","Max"
"Terapon jarbua","American Samoa Exclusive Economic Zone",0,0,0.000785373207375874,0.0130111664125773
"Terapon jarbua","Australian Exclusive Economic Zone",0,0,0.00434337287958763,0.768224618464842
"Terapon jarbua","Bahraini Exclusive Economic Zone",0,0,0.0385777762820688,0.0642756330191305
"Terapon jarbua","Bangladeshi Exclusive Economic Zone",0.0714285714285714,0,0.212232407722695,2.46398183319787
"Terapon jarbua","Bassas da India Exclusive Economic Zone",0,0,0.000149919006688227,0.00075093586554231
"Terapon jarbua","Bruneian Exclusive Economic Zone",0,0,0.000224611122521251,0.00590666430659832
"Terapon jarbua","Cambodian Exclusive Economic Zone",0,0,0.00137850891406334,0.0138580514019386
"Terapon jarbua","Chagos Archipelago Exclusive Economic Zone",0,0,7.91735807134653e-05,0.000400547327571487
"Terapon jarbua","Chinese Exclusive Economic Zone",0,0,0.0213656255120015,1.58778523869849
"Terapon jarbua","Christmas Island Exclusive Economic Zone",0,0,4.07103445697615e-05,0.000203606850750158
"Terapon jarbua","Cocos Islands Exclusive Economic Zone",0,0,0.00130441918675775,0.0063170487883767
"Terapon jarbua","Comoran Exclusive Economic Zone",0,0,8.36853845266489e-05,0.000308070933133335
"Terapon jarbua","Cook Islands Exclusive Economic Zone",0,0,0.000256191800438059,0.00026870471428171
"Terapon jarbua","Djiboutian Exclusive Economic Zone",0,0,0.00591261036189092,0.0366528369068165
"Terapon jarbua","East Timorian Exclusive Economic Zone",0,0,0.00297305782461165,0.0149837821528182
"Terapon jarbua","Egyptian Exclusive Economic Zone",0,0,0.00647482441336367,0.026254684560808
"Terapon jarbua","Eritrean Exclusive Economic Zone",0,0,0.0125730438153421,0.308821160489267
"Terapon jarbua","Fijian Exclusive Economic Zone",0,0,0.00242795213737075,0.15051739018568
"Terapon jarbua","Guam Exclusive Economic Zone",0,0,8.00083981580972e-05,9.20823866905103e-05
"Terapon jarbua","Howland and Baker Islands Exclusive Economic Zone",0,0,0.00159234976346545,0.00215357318066276
"Terapon jarbua","Ile Europa Exclusive Economic Zone",0,0,0.00015608856287854,0.00075093586554231
"Terapon jarbua","Indian Exclusive Economic Zone",0,0,0.0100261397076366,0.488568273260869
"Terapon jarbua","Indian Exclusive Economic Zone (Andaman and Nicobar Islands)",0,0,0.00289004631319849,0.125631856549449
"Terapon jarbua","Indonesian Exclusive Economic Zone",0,0,0.00235331129527296,0.368227597155203
"Terapon jarbua","Iranian Exclusive Economic Zone",0,0,0.0840855532519689,1.06018795066267
"Terapon jarbua","Japanese Exclusive Economic Zone",0,0,0.0203530732340937,1.08673886555341
"Terapon jarbua","Johnston Atoll Exclusive Economic Zone",0,0,0.00438482256171784,0.00571974243330102
"Terapon jarbua","Joint regime area Australia / Papua New Guinea",0,0,0.000338385654143258,0.00110215511258349
"Terapon jarbua","Joint regime area Japan / Korea",0,0,0.00475900877844863,0.0518937476583927
"Terapon jarbua","Juan de Nova Exclusive Economic Zone",0,0,8.89206506790715e-05,0.000265795394507478
"Terapon jarbua","Kenyan Exclusive Economic Zone",0,0,0.000377690387435819,0.0038486984239417
"Terapon jarbua","Kiribati Exclusive Economic Zone (Gilbert Islands)",0,0,0.00185322877502677,0.368227597155203
"Terapon jarbua","Kiribati Exclusive Economic Zone (Phoenix Islands)",0,0,0.000194896244920912,0.00215357318066276
"Terapon jarbua","Kuwaiti Exclusive Economic Zone",0,0,0.420782417743613,1.06018795066267
"Terapon jarbua","Madagascan Exclusive Economic Zone",0,0,0.000515644565173508,0.0260132265361474
"Terapon jarbua","Malaysian Exclusive Economic Zone",0,0,0.0020236907405103,0.368227597155203
"Terapon jarbua","Maldives Exclusive Economic Zone",0,0,0.000473245435392709,0.00218176137988277
"Terapon jarbua","Marshall Islands Exclusive Economic Zone",0,0,0.000264802557036169,0.00488741465647331
"Terapon jarbua","Mauritian Exclusive Economic Zone",0,0,0.000213418281839568,0.00139087645935315
"Terapon jarbua","Micronesian Exclusive Economic Zone",0,0,0.00124954023157258,0.00783974719088233
"Terapon jarbua","Mozambican Exclusive Economic Zone",0,0,0.00344382205127568,0.15051739018568
"Terapon jarbua","Myanmar Exclusive Economic Zone",0,0,0.00683001719304891,0.163223072047235
"Terapon jarbua","Nauruan Exclusive Economic Zone",0,0,0.00156007040697289,0.00677016056780165
"Terapon jarbua","New Caledonian Exclusive Economic Zone",0,0,0.000246700933428037,0.00882705477919728
"Terapon jarbua","New Zealand Exclusive Economic Zone",0,0,0.0185562415667529,0.768224618464842
"Terapon jarbua","Norfolk Island Exclusive Economic Zone",0,0,0.00173588861160314,0.0158876355898976
"Terapon jarbua","Northern Mariana Exclusive Economic Zone",0,0,0.000308358062227143,0.000985693753492458
"Terapon jarbua","Oecussi Ambeno Exclusive Economic Zone",0,0,4.77527010569222e-05,7.731512746554e-05
"Terapon jarbua","Omani Exclusive Economic Zone",0,0,0.0482643149007035,0.697551200116823
"Terapon jarbua","Overlapping claim Glorioso Islands: France / Madagascar",0,0,5.7313727307994e-05,0.000257447315139866
"Terapon jarbua","Overlapping claim Ile Tromelin: Reunion / Madagascar / Mauritus",0,0,0.000249060482005556,0.000293925781769354
"Terapon jarbua","Overlapping claim Matthew and Hunter Islands: New Caledonia / Vanuatu",0,0,0.000116813279247595,0.000263433427033594
"Terapon jarbua","Overlapping claim Mayotte: France / Comoros",0,0,8.6137893899043e-05,0.000308070933133335
"Terapon jarbua","Overlapping claim Senkaku Islands: Japan / China / Taiwan",0,0,0.00377829271561473,0.0434729214195658
"Terapon jarbua","Overlapping claim South China Sea",0,0,0.000480445288524558,0.00564112242907648
"Terapon jarbua","Overlapping claim: Iran / United Arab Emirates",0,0,0.0966555832904688,0.323593417722191
"Terapon jarbua","Overlapping claim: Kenya / Somalia",0,0,0.000152790451080734,0.000479793261395558
"Terapon jarbua","Pakistani Exclusive Economic Zone",0,0,0.000519753033088677,0.0108828415946556
"Terapon jarbua","Palau Exclusive Economic Zone",0,0,0.00137987194595907,0.00364986031494779
"Terapon jarbua","Papua New Guinean Exclusive Economic Zone",0,0,0.000446454627695765,0.102051387433856
"Terapon jarbua","Philippines Exclusive Economic Zone",0,0,0.00404379102415988,1.41728288745588
"Terapon jarbua","Qatari Exclusive Economic Zone",0,0,0.123747250088188,0.467735467782341
"Terapon jarbua","Réunion Exclusive Economic Zone",0,0,0.000110335759468603,0.000370415735392446
"Terapon jarbua","Samoan Exclusive Economic Zone",0,0,0.000932352582544628,0.0130111664125773
"Terapon jarbua","Saudi Arabian Exclusive Economic Zone",0,0,0.0569538362209311,1.06018795066267
"Terapon jarbua","Seychellois Exclusive Economic Zone",0,0,3.88195567107292e-05,0.000324977474906211
"Terapon jarbua","Solomon Islands Exclusive Economic Zone",0,0,0.000624201370864345,0.0088147568033419
"Terapon jarbua","Somali Exclusive Economic Zone",0,0,0.00477450842339123,0.244384758429922
"Terapon jarbua","South African Exclusive Economic Zone",0,0,0.0317158523370356,0.283272676489916
"Terapon jarbua","South Korean Exclusive Economic Zone",0,0,0.0333226123911458,1.08673886555341
"Terapon jarbua","Sri Lankan Exclusive Economic Zone",0,0,0.0130762995538486,0.410870645979724
"Terapon jarbua","Sudanese Exclusive Economic Zone",0,0,0.0354170117823709,0.0999828431157446
"Terapon jarbua","Taiwanese Exclusive Economic Zone",0,0,0.0170786695059921,1.09803950756404
"Terapon jarbua","Tanzanian Exclusive Economic Zone",0,0,0.000249972880408652,0.00128424251599035
"Terapon jarbua","Thailand Exclusive Economic Zone",0,0,0.00374620581188585,0.266832947166629
"Terapon jarbua","Tokelau Exclusive Economic Zone",0,0,0.00270377185517491,0.00797786441625053
"Terapon jarbua","Tongan Exclusive Economic Zone",0,0,0.000204167870852517,0.00382896869347989
"Terapon jarbua","Tuvaluan Exclusive Economic Zone",0,0,0.00173775243117666,0.196445155019195
"Terapon jarbua","United Arab Emirates Exclusive Economic Zone",0,0,0.147407056491466,0.467735467782341
"Terapon jarbua","United States Exclusive Economic Zone (Hawaii)",0.000629326620516048,0,0.0206846531576968,2.46398183319787
"Terapon jarbua","Vanuatu Exclusive Economic Zone",0,0,0.000135040133805354,0.00170566965657042
"Terapon jarbua","Vietnamese Exclusive Economic Zone",0,0,0.00967150340149198,0.742317069367996
"Terapon jarbua","Wake Island Exclusive Economic Zone",0,0,0.000685914992616327,0.000813321527372578
"Terapon jarbua","Wallis and Futuna Exclusive Economic Zone",0,0,0.00357516150681845,0.115757502627043
"Terapon jarbua","Yemeni Exclusive Economic Zone",0,0,0.00643094408771082,0.290014153413261
