"Species","EEZ","p2","p4","Average","Max"
"Mytilus coruscus","Chinese Exclusive Economic Zone",0.96,0.22,3.43344900293202,8.2923610758136
"Mytilus coruscus","Japanese Exclusive Economic Zone",0.487430167597765,0.23463687150838,2.75007826384184,8.2923610758136
"Mytilus coruscus","Joint regime area Japan / Korea",1,0.606060606060606,5.3528341242618,8.2923610758136
"Mytilus coruscus","North Korean Exclusive Economic Zone",0,0,0.453440882871325,1.21162420978953
"Mytilus coruscus","Overlapping claim Liancourt Rocks: Japan / South Korea",0,0,0.892192419172958,0.998551705879253
"Mytilus coruscus","Russian Exclusive economic Zone",0.0413793103448276,0.0137931034482759,0.783274965969698,8.2923610758136
"Mytilus coruscus","South Korean Exclusive Economic Zone",0.523297491039427,0.240143369175627,2.89019648695942,8.2923610758136
"Mytilus coruscus","Taiwanese Exclusive Economic Zone",0.833333333333333,0.333333333333333,3.77586398563536,7.78259061780245
