"Species","EEZ","p2","p4","Average","Max"
"Naso vlamingii","American Samoa Exclusive Economic Zone",1,0.985422740524781,6.51138293153738,7.62547420983562
"Naso vlamingii","Australian Exclusive Economic Zone",0.703581101414385,0.518808305747818,3.65291989695688,8.2923610758136
"Naso vlamingii","Bassas da India Exclusive Economic Zone",0.0166666666666667,0,1.23445526627613,2.05123003587136
"Naso vlamingii","Bruneian Exclusive Economic Zone",1,1,4.96436249700504,6.83925056057267
"Naso vlamingii","Cambodian Exclusive Economic Zone",1,0.473282442748092,3.86204445189257,5.24560467193528
"Naso vlamingii","Chagos Archipelago Exclusive Economic Zone",1,1,5.98865220217458,6.70815858476465
"Naso vlamingii","Chinese Exclusive Economic Zone",0.508565310492505,0.202355460385439,2.35819400102164,6.25414150140722
"Naso vlamingii","Christmas Island Exclusive Economic Zone",1,0,2.6730907297825,2.81257273330642
"Naso vlamingii","Clipperton Exclusive Economic Zone",1,0,2.12541073126692,2.17931407851284
"Naso vlamingii","Cocos Islands Exclusive Economic Zone",1,0,2.52816764982616,2.92382726557455
"Naso vlamingii","Comoran Exclusive Economic Zone",1,0,3.30736010002199,3.87576844420089
"Naso vlamingii","Cook Islands Exclusive Economic Zone",0.575039494470774,0.497630331753554,3.50250653929164,7.34139024303719
"Naso vlamingii","East Timorian Exclusive Economic Zone",1,1,5.65286477006874,6.22099065302494
"Naso vlamingii","Ecuadorian Exclusive Economic Zone (Galapagos)",0,0,0.1052711627304,0.63669952197287
"Naso vlamingii","El Salvador Exclusive Economic Zone",0.307692307692308,0,1.82743491727382,2.63480445043934
"Naso vlamingii","Fijian Exclusive Economic Zone",0.550946142649199,0.311083385319193,2.76599996542351,8.2923610758136
"Naso vlamingii","French Polynesian Exclusive Economic Zone",0.348542458808619,0.0730882974228982,1.53473366697897,6.24812321311657
"Naso vlamingii","Guam Exclusive Economic Zone",1,1,5.9510639186588,6.04998178611522
"Naso vlamingii","Guatemalan Exclusive Economic Zone",0.64,0,2.21796863492178,3.1754281020066
"Naso vlamingii","Howland and Baker Islands Exclusive Economic Zone",1,1,6.46541939332463,7.1198470395608
"Naso vlamingii","Ile Europa Exclusive Economic Zone",0.0151515151515152,0,1.18489089123349,2.05123003587136
"Naso vlamingii","Indian Exclusive Economic Zone",1,0.987951807228916,7.36124795518796,8.2923610758136
"Naso vlamingii","Indian Exclusive Economic Zone (Andaman and Nicobar Islands)",0.982646420824295,0.58351409978308,3.98630375539071,5.92730052456797
"Naso vlamingii","Indonesian Exclusive Economic Zone",0.983574754267977,0.826823590274185,5.18389702915427,8.2923610758136
"Naso vlamingii","Japanese Exclusive Economic Zone",0.192789968652038,0.137931034482759,1.39652316208212,6.03180119382215
"Naso vlamingii","Jarvis Island Exclusive Economic Zone",1,0.619047619047619,4.39360539346165,5.92437890468429
"Naso vlamingii","Johnston Atoll Exclusive Economic Zone",0,0,0.821526123985705,0.852519298095368
"Naso vlamingii","Joint regime area Australia / Papua New Guinea",1,0,3.3586234033682,3.54568103059708
"Naso vlamingii","Joint regime area Japan / Korea",0,0,0.857467868108101,1.40306274149551
"Naso vlamingii","Juan de Nova Exclusive Economic Zone",1,0,3.47999694376794,3.93299378285546
"Naso vlamingii","Kenyan Exclusive Economic Zone",0.607594936708861,0.0379746835443038,2.35148099827113,4.09681978794141
"Naso vlamingii","Kiribati Exclusive Economic Zone (Gilbert Islands)",0.977054848341977,0.851485148514851,5.64519402113695,8.2923610758136
"Naso vlamingii","Kiribati Exclusive Economic Zone (Line Islands)",0.910614525139665,0.541899441340782,4.21029741839807,6.9391951385934
"Naso vlamingii","Kiribati Exclusive Economic Zone (Phoenix Islands)",1,1,5.07296216966881,7.1198470395608
"Naso vlamingii","Madagascan Exclusive Economic Zone",0.644770959377701,0.128781331028522,2.49825776086986,6.62627264099683
"Naso vlamingii","Malaysian Exclusive Economic Zone",0.998811645870469,0.607248960190137,4.54308423048311,8.2923610758136
"Naso vlamingii","Maldives Exclusive Economic Zone",1,1,7.02353605481007,7.78660480135437
"Naso vlamingii","Marshall Islands Exclusive Economic Zone",1,1,5.87961954578655,7.40413757010257
"Naso vlamingii","Mauritian Exclusive Economic Zone",0.508250825082508,0.161716171617162,2.34507335769645,4.468858386882
"Naso vlamingii","Mexican Exclusive Economic Zone",0.697368421052632,0.125,2.52771929415402,4.9291433782612
"Naso vlamingii","Micronesian Exclusive Economic Zone",1,1,6.58579232493707,7.83272812687186
"Naso vlamingii","Mozambican Exclusive Economic Zone",0.445742904841402,0,1.66269312757342,3.8697279159987
"Naso vlamingii","Myanmar Exclusive Economic Zone",0.94488188976378,0.254593175853018,3.25679902326632,5.38942174823102
"Naso vlamingii","Nauruan Exclusive Economic Zone",1,1,7.44798838682801,8.07657100413013
"Naso vlamingii","New Caledonian Exclusive Economic Zone",0.1577752553916,0.0317820658342792,0.710762021804509,4.86605198597815
"Naso vlamingii","New Zealand Exclusive Economic Zone",0,0,0.00705367937442318,0.0870083389842288
"Naso vlamingii","Nicaraguan Exclusive Economic Zone",0.6,0,2.12827598082522,2.63480445043934
"Naso vlamingii","Niue Exclusive Economic Zone",0.136986301369863,0,1.28767586735118,2.50967375323567
"Naso vlamingii","Northern Mariana Exclusive Economic Zone",0.970930232558139,0.924418604651163,5.24468753117473,6.04998178611522
"Naso vlamingii","Oecussi Ambeno Exclusive Economic Zone",1,1,4.08890651673718,4.20944790629319
"Naso vlamingii","Overlapping claim Glorioso Islands: France / Madagascar",0.985915492957746,0.0422535211267606,2.91162556989489,4.21674026997979
"Naso vlamingii","Overlapping claim Ile Tromelin: Reunion / Madagascar / Mauritus",0,0,1.85970087380748,1.90017335431916
"Naso vlamingii","Overlapping claim Matthew and Hunter Islands: New Caledonia / Vanuatu",0,0,0.00911082823224703,0.115468340863576
"Naso vlamingii","Overlapping claim Mayotte: France / Comoros",1,0.0265486725663717,3.3952667457232,4.28691813283356
"Naso vlamingii","Overlapping claim Senkaku Islands: Japan / China / Taiwan",0.256410256410256,0,1.48170452792698,2.80295583672912
"Naso vlamingii","Overlapping claim South China Sea",0.930743243243243,0.525337837837838,3.86269450032262,7.37412877428388
"Naso vlamingii","Overlapping claim: Kenya / Somalia",0.7,0,2.20703550211424,2.89672833798545
"Naso vlamingii","Palau Exclusive Economic Zone",1,1,6.09092302629049,6.62163794892619
"Naso vlamingii","Palmyra Atoll Exclusive Economic Zone",1,0.486033519553073,3.93328097335179,4.41250753196171
"Naso vlamingii","Papua New Guinean Exclusive Economic Zone",1,0.867695700110254,5.87934409505157,7.81374999042357
"Naso vlamingii","Philippines Exclusive Economic Zone",0.972808251289264,0.917018284106892,5.58376153982596,8.2923610758136
"Naso vlamingii","Réunion Exclusive Economic Zone",0,0,0.266603498354742,0.485810912550385
"Naso vlamingii","Samoan Exclusive Economic Zone",1,1,6.30236621559101,7.54512299482975
"Naso vlamingii","Seychellois Exclusive Economic Zone",0.985401459854015,0.458637469586375,4.19592821219248,6.19967286935286
"Naso vlamingii","Solomon Islands Exclusive Economic Zone",1,0.95480690221857,6.37894304385789,7.44670367846749
"Naso vlamingii","Somali Exclusive Economic Zone",0.915254237288136,0.0903954802259887,2.90596461313473,4.47350432453263
"Naso vlamingii","South African Exclusive Economic Zone",0,0,0.000298595841614304,0.00261230472518983
"Naso vlamingii","South Korean Exclusive Economic Zone",0,0,0.240832307372947,0.326223596591145
"Naso vlamingii","Sri Lankan Exclusive Economic Zone",1,1,5.7161745430816,7.95603812548153
"Naso vlamingii","Taiwanese Exclusive Economic Zone",0.684931506849315,0.30365296803653,2.89004224799487,5.94363235034543
"Naso vlamingii","Tanzanian Exclusive Economic Zone",0.959537572254335,0.15606936416185,3.28554836220358,5.33799858330231
"Naso vlamingii","Thailand Exclusive Economic Zone",0.978533094812165,0.617173524150268,4.1466019789445,8.16070784085858
"Naso vlamingii","Tokelau Exclusive Economic Zone",1,1,7.25859844132306,7.62547420983562
"Naso vlamingii","Tongan Exclusive Economic Zone",0.431438127090301,0.327759197324415,2.25450739158085,6.05418200348784
"Naso vlamingii","Tuvaluan Exclusive Economic Zone",0.952017309405626,0.742649866361207,5.04900999935248,7.91652071247119
"Naso vlamingii","United States Exclusive Economic Zone",0.444444444444444,0,1.89394954476758,2.4979850100061
"Naso vlamingii","United States Exclusive Economic Zone (Hawaii)",0.405711885762285,0.216295674086518,2.12363271817856,8.02695701803389
"Naso vlamingii","Vanuatu Exclusive Economic Zone",0.415812591508053,0.253294289897511,2.04344710258959,6.58140373025277
"Naso vlamingii","Vietnamese Exclusive Economic Zone",0.731979695431472,0.114720812182741,2.67295327086644,5.90722704508155
"Naso vlamingii","Wake Island Exclusive Economic Zone",1,0.357142857142857,3.85300159558285,4.23549617380835
"Naso vlamingii","Wallis and Futuna Exclusive Economic Zone",0.935133938454727,0.586893956165597,4.54814182191596,7.96402361512231
