"Species","EEZ","p2","p4","Average","Max"
"Argyrosomus regius","Albanian Exclusive Economic Zone",0,0,0.590653818874509,1.44083059787846
"Argyrosomus regius","Algerian Exclusive Economic Zone",0,0,0.502056605611556,1.50682917501851
"Argyrosomus regius","Angolan Exclusive Economic Zone",0.6875,0.625,4.75005749805288,8.2923610758136
"Argyrosomus regius","Beninese Exclusive Economic Zone",1,0,3.01050351895312,3.01050351895312
"Argyrosomus regius","Cameroonian Exclusive Economic Zone",0.545454545454545,0,2.1721856359894,3.65725441994566
"Argyrosomus regius","Congolese Exclusive Economic Zone",0.333333333333333,0.285714285714286,2.73068903710833,8.2923610758136
"Argyrosomus regius","Croatian Exclusive Economic Zone",0.0483870967741935,0.00806451612903226,0.837028167091548,4.10332795119452
"Argyrosomus regius","Cypriote Exclusive Economic Zone",1,0,2.43472785299438,2.86187941133261
"Argyrosomus regius","Democratic Republic of the Congo Exclusive Economic Zone",0.888888888888889,0.888888888888889,6.39626754718697,8.2923610758136
"Argyrosomus regius","Egyptian Exclusive Economic Zone",0.48,0,1.98894310706373,3.07402965673596
"Argyrosomus regius","Equatorial Guinean Exclusive Economic Zone",0.470588235294118,0,2.12073126380695,3.79889765349663
"Argyrosomus regius","French Exclusive Economic Zone",0.0136612021857923,0,0.384232609368161,3.15080814007158
"Argyrosomus regius","Gabonese Exclusive Economic Zone",0.245283018867925,0,1.69312171359038,3.79889765349663
"Argyrosomus regius","Gambian Exclusive Economic Zone",1,0,2.87539894493918,3.44854653515994
"Argyrosomus regius","Ghanaian Exclusive Economic Zone",1,0.103448275862069,3.48307718259226,4.48653170060003
"Argyrosomus regius","Greek Exclusive Economic Zone",0.00555555555555556,0,0.398007873292186,2.26261106525034
"Argyrosomus regius","Guernsey Exclusive Economic Zone",0,0,0.206158408552996,0.701314807344599
"Argyrosomus regius","Guinea Bissau Exclusive Economic Zone",0.313131313131313,0,1.43074788223707,3.3317796479414
"Argyrosomus regius","Guinean Exclusive Economic Zone",0.186991869918699,0,0.984962687435983,3.3774817777014
"Argyrosomus regius","Irish Exclusive Economic Zone",0,0,0.0844076254468801,0.120855615369867
"Argyrosomus regius","Israeli Exclusive Economic Zone",0.782608695652174,0,2.41549288473214,3.07402965673596
"Argyrosomus regius","Italian Exclusive Economic Zone",0.0429252782193959,0.027027027027027,0.919633416758146,8.2923610758136
"Argyrosomus regius","Ivory Coast Exclusive Economic Zone",0.833333333333333,0,2.65786095278509,3.22973072685144
"Argyrosomus regius","Jersey Exclusive Economic Zone",0,0,1.04197105418604,1.70374392855546
"Argyrosomus regius","Joint regime area Croatia / Slovenia",0,0,1.56315959295523,1.56315959295523
"Argyrosomus regius","Joint regime area Senegal / Guinea Bissau",0.555555555555556,0,2.17018372369061,3.11498992538055
"Argyrosomus regius","Lebanese Exclusive Economic Zone",1,0,2.58379791255364,2.86187941133261
"Argyrosomus regius","Liberian Exclusive Economic Zone",0,0,0.619020398152911,1.88616170149102
"Argyrosomus regius","Libyan Exclusive Economic Zone",0.0238095238095238,0,1.37099503974774,2.11241037964934
"Argyrosomus regius","Maltese Exclusive Economic Zone",0,0,0.572900739444814,0.689096083150713
"Argyrosomus regius","Mauritanian Exclusive Economic Zone",0.636363636363636,0.145454545454545,2.72342786774082,8.2923610758136
"Argyrosomus regius","Monégasque Exclusive Economic Zone",0,0,0.274826832845181,0.531288848198524
"Argyrosomus regius","Montenegrin Exclusive economic Zone",0,0,0.490493349829492,0.674282991335314
"Argyrosomus regius","Moroccan Exclusive Economic Zone",0.00680272108843537,0,0.230943907885307,2.05115382270983
"Argyrosomus regius","Nigerian Exclusive Economic Zone",0.981481481481482,0.0185185185185185,2.84337144780255,4.29169400419109
"Argyrosomus regius","Overlapping claim Chafarinas Islands: Spain / Morocco",0,0,0.417928448563745,0.417928448563745
"Argyrosomus regius","Overlapping claim Gibraltarian Exclusive Economic Zone",0,0,0.102915936829781,0.111475617713813
"Argyrosomus regius","Overlapping claim Melilla: Spain / Morocco",0,0,0.268879835582195,0.268879835582195
"Argyrosomus regius","Overlapping claim Western Saharan Exclusive Economic Zone",0.1796875,0.03125,1.32177072314697,8.2923610758136
"Argyrosomus regius","Palestinian Exclusive Economic Zone",1,0,2.62543232094526,2.8876514573875
"Argyrosomus regius","Portuguese Exclusive Economic Zone",0,0,0.352114480137707,1.53405251466331
"Argyrosomus regius","Sao Tome and Principe Exclusive Economic Zone",0,0,1.31037134768443,1.32691320329493
"Argyrosomus regius","Saudi Arabian Exclusive Economic Zone",1,1,8.2923610758136,8.2923610758136
"Argyrosomus regius","Senegalese Exclusive Economic Zone",0.657534246575342,0.0547945205479452,2.35693014792812,4.60294465736799
"Argyrosomus regius","Sierra Leonian Exclusive Economic Zone",0.0638297872340425,0,0.631355720369736,3.3774817777014
"Argyrosomus regius","Slovenian Exclusive Economic Zone",1,0,3.59399368996315,3.59399368996315
"Argyrosomus regius","Spanish Exclusive Economic Zone",0.0117370892018779,0,0.37758391566777,3.15080814007158
"Argyrosomus regius","Spanish Exclusive Economic Zone (Canary Islands)",0.087719298245614,0,0.974462288801848,2.56612871111471
"Argyrosomus regius","Sudanese Exclusive Economic Zone",1,1,8.2923610758136,8.2923610758136
"Argyrosomus regius","Syrian Exclusive Economic Zone",1,0,2.51788584039856,2.53469961119452
"Argyrosomus regius","Togolese Exclusive Economic Zone",1,0,2.89362646503828,3.46394531733062
"Argyrosomus regius","Tunisian Exclusive Economic Zone",0.123076923076923,0,0.970823880812311,3.16269750913776
"Argyrosomus regius","Turkish Exclusive Economic Zone",0.511904761904762,0,1.46095618936216,3.23596944460589
"Argyrosomus regius","United Kingdom Exclusive Economic Zone",0,0,0.380761345978972,1.70374392855546
