"Species","EEZ","p2","p4","Average","Max"
"Oncorhynchus kisutch","Canadian Exclusive Economic Zone",0.0708661417322835,0.0094488188976378,0.730091997448036,8.2923610758136
"Oncorhynchus kisutch","Japanese Exclusive Economic Zone",0.698170731707317,0.445121951219512,3.38343702270994,7.50964938767431
"Oncorhynchus kisutch","Joint regime area United States / Russia",0.0800959232613909,0.000479616306954436,0.630646811305835,4.52509854139583
"Oncorhynchus kisutch","Mexican Exclusive Economic Zone",1,1,8.2923610758136,8.2923610758136
"Oncorhynchus kisutch","Overlapping claim Kuril Islands: Japan / Russia",0.444444444444444,0.251461988304094,2.42283210820582,6.47010150865711
"Oncorhynchus kisutch","Russian Exclusive economic Zone",0.129975770162686,0.0384215991692627,0.86492273059367,8.2923610758136
"Oncorhynchus kisutch","United States Exclusive Economic Zone",0.402439024390244,0.215447154471545,2.26321453275894,8.2923610758136
"Oncorhynchus kisutch","United States Exclusive Economic Zone (Alaska)",0.0832369942196532,0.00712909441233141,0.663081237801902,5.37773093462327
"Oncorhynchus kisutch","United States Exclusive Economic Zone (Hawaii)",1,1,8.2923610758136,8.2923610758136
