"Species","EEZ","p2","p4","Average","Max"
"Portunus pelagicus","Algerian Exclusive Economic Zone",0,0,0.00290809491157672,0.0315637999378496
"Portunus pelagicus","American Samoa Exclusive Economic Zone",0,0,0.00140678162021793,0.0130109135940187
"Portunus pelagicus","Australian Exclusive Economic Zone",0,0,0.00478374433649873,0.186861724517424
"Portunus pelagicus","Bahraini Exclusive Economic Zone",0,0,0.0817920060866897,0.202246092737643
"Portunus pelagicus","Bassas da India Exclusive Economic Zone",0,0,0.000822385141495256,0.00208746128838997
"Portunus pelagicus","Bruneian Exclusive Economic Zone",0,0,0.000401018175783027,0.00590647306216043
"Portunus pelagicus","Cambodian Exclusive Economic Zone",0,0,0.00137236036058901,0.0138499030861168
"Portunus pelagicus","Chagos Archipelago Exclusive Economic Zone",0,0,7.30365035678811e-05,0.000454356797511501
"Portunus pelagicus","Chilean Exclusive Economic Zone",0.00854700854700855,0,0.349820100025054,2.00951537990563
"Portunus pelagicus","Chilean Exclusive Economic Zone (San Felix and San Ambrosio islands)",0,0,0.00289766848728199,0.00617641488102941
"Portunus pelagicus","Chinese Exclusive Economic Zone",0,0,0.0316910334686391,1.58778979812912
"Portunus pelagicus","Christmas Island Exclusive Economic Zone",0,0,4.86627119872141e-05,6.57823769644797e-05
"Portunus pelagicus","Clipperton Exclusive Economic Zone",0,0,3.5756150185078e-05,6.09113169651416e-05
"Portunus pelagicus","Cocos Islands Exclusive Economic Zone",0,0,0.000363317600595443,0.0013479054751553
"Portunus pelagicus","Colombian Exclusive Economic Zone",0,0,0.0174758645852989,0.523382819396539
"Portunus pelagicus","Comoran Exclusive Economic Zone",0,0,0.000100758670576782,0.000370256478989331
"Portunus pelagicus","Cook Islands Exclusive Economic Zone",0,0,0.00176920147975832,0.0144294359523374
"Portunus pelagicus","Costa Rican Exclusive Economic Zone",0,0,0.00243323974589747,0.0284398918940486
"Portunus pelagicus","Croatian Exclusive Economic Zone",0,0,0.131440574197085,0.609280715141735
"Portunus pelagicus","Djiboutian Exclusive Economic Zone",0,0,0.00608882401546284,0.0366213314125331
"Portunus pelagicus","East Timorian Exclusive Economic Zone",0,0,0.00356883641534174,0.0204070471125499
"Portunus pelagicus","Ecuadorian Exclusive Economic Zone",0,0,0.0524313356071392,0.567717762544011
"Portunus pelagicus","Ecuadorian Exclusive Economic Zone (Galapagos)",0,0,0.0737332098457292,0.805975196279953
"Portunus pelagicus","El Salvador Exclusive Economic Zone",0,0,0.00822224983144937,0.0695197129207586
"Portunus pelagicus","Eritrean Exclusive Economic Zone",0,0,0.0253935866590154,0.337668993861394
"Portunus pelagicus","Fijian Exclusive Economic Zone",0.000198255352894528,0,0.0129486045323482,2.00951537990563
"Portunus pelagicus","French Exclusive Economic Zone",0,0,0.0147509541294356,0.0147509541294356
"Portunus pelagicus","French Polynesian Exclusive Economic Zone",0,0,0.00125839063251409,0.0408442112379745
"Portunus pelagicus","Greek Exclusive Economic Zone",0,0,0.0401708509400748,0.246336226893614
"Portunus pelagicus","Guam Exclusive Economic Zone",0,0,8.00029820652621e-05,9.21952881079371e-05
"Portunus pelagicus","Guatemalan Exclusive Economic Zone",0,0,0.0073297873260456,0.0695197129207586
"Portunus pelagicus","Honduran Exclusive Economic Zone",0,0,0.0284458898813649,0.0636741786882612
"Portunus pelagicus","Howland and Baker Islands Exclusive Economic Zone",0,0,0.001602229005824,0.00216730199299447
"Portunus pelagicus","Ile Europa Exclusive Economic Zone",0,0,0.000822385141495256,0.00208746128838997
"Portunus pelagicus","Indian Exclusive Economic Zone",0,0,0.0138214701029444,0.410843890890605
"Portunus pelagicus","Indian Exclusive Economic Zone (Andaman and Nicobar Islands)",0,0,0.00157578172386187,0.0262067814925938
"Portunus pelagicus","Indonesian Exclusive Economic Zone",0,0,0.00249394954058089,0.368477364611705
"Portunus pelagicus","Iranian Exclusive Economic Zone",0,0,0.0998438712404046,1.06019077418214
"Portunus pelagicus","Italian Exclusive Economic Zone",0,0,0.0654484025747265,1.40352832417187
"Portunus pelagicus","Japanese Exclusive Economic Zone",0,0,0.0573541210583192,1.28163572508395
"Portunus pelagicus","Jarvis Island Exclusive Economic Zone",0,0,0.00155546897807691,0.00558738412481309
"Portunus pelagicus","Johnston Atoll Exclusive Economic Zone",0,0,0.00553358488375258,0.00575652843928083
"Portunus pelagicus","Joint regime area Australia / Papua New Guinea",0,0,0.000451793494792902,0.00110218561991464
"Portunus pelagicus","Joint regime area Croatia / Slovenia",0,0,0.609280715141735,0.609280715141735
"Portunus pelagicus","Joint regime area Ecuador / Colombia",0,0,0.000299786497394906,0.000493006086341615
"Portunus pelagicus","Joint regime area Japan / Korea",0,0,0.00545332158966324,0.0420269613777288
"Portunus pelagicus","Joint regime area Peru / Ecuador",0,0,0.337346584045164,0.567717762544011
"Portunus pelagicus","Juan de Nova Exclusive Economic Zone",0,0,0.000106722348142627,0.000138600709592457
"Portunus pelagicus","Kenyan Exclusive Economic Zone",0,0,0.0006396405383404,0.00384833923397517
"Portunus pelagicus","Kiribati Exclusive Economic Zone (Gilbert Islands)",0,0,0.00584572125789888,0.805975196279953
"Portunus pelagicus","Kiribati Exclusive Economic Zone (Line Islands)",0,0,0.000316939542999254,0.00558738412481309
"Portunus pelagicus","Kiribati Exclusive Economic Zone (Phoenix Islands)",0,0,0.000231680377822002,0.00216730199299447
"Portunus pelagicus","Kuwaiti Exclusive Economic Zone",0,0,0.42077181885312,1.06019077418214
"Portunus pelagicus","Libyan Exclusive Economic Zone",0,0,0.00440463364241702,0.123354859006723
"Portunus pelagicus","Madagascan Exclusive Economic Zone",0,0,0.00056988691775269,0.02397293119612
"Portunus pelagicus","Malaysian Exclusive Economic Zone",0,0,0.00181471495893353,0.368222928342533
"Portunus pelagicus","Maldives Exclusive Economic Zone",0,0,0.000473311287520678,0.0021801785732312
"Portunus pelagicus","Maltese Exclusive Economic Zone",0,0,0.00530205717819196,0.0254821938751728
"Portunus pelagicus","Marshall Islands Exclusive Economic Zone",0,0,0.000288412106843479,0.00488746700908227
"Portunus pelagicus","Mauritian Exclusive Economic Zone",0,0,0.000264554693896478,0.00239232431857379
"Portunus pelagicus","Mexican Exclusive Economic Zone",0,0,0.0239047605483154,0.631697096586719
"Portunus pelagicus","Micronesian Exclusive Economic Zone",0,0,0.00111076700581524,0.00638252521116392
"Portunus pelagicus","Moroccan Exclusive Economic Zone",0,0,0.00421220047431618,0.0376215945246203
"Portunus pelagicus","Mozambican Exclusive Economic Zone",0,0,0.00294430345955551,0.140265441149303
"Portunus pelagicus","Myanmar Exclusive Economic Zone",0,0,0.00330709411161573,0.0555179917475926
"Portunus pelagicus","Nauruan Exclusive Economic Zone",0,0,0.00177853315371185,0.00786341683581204
"Portunus pelagicus","New Caledonian Exclusive Economic Zone",0,0,0.000257851489564685,0.00678721246137363
"Portunus pelagicus","New Zealand Exclusive Economic Zone",0,0,0.0210198573883834,1.82739888383728
"Portunus pelagicus","Nicaraguan Exclusive Economic Zone",0,0,0.00536121859416673,0.0636741786882612
"Portunus pelagicus","Norfolk Island Exclusive Economic Zone",0,0,0.00491848250550387,0.0673691200264213
"Portunus pelagicus","North Korean Exclusive Economic Zone",0,0,0.264483558724701,0.303691988208853
"Portunus pelagicus","Northern Mariana Exclusive Economic Zone",0,0,0.000374111225537383,0.000981932802137397
"Portunus pelagicus","Oecussi Ambeno Exclusive Economic Zone",0,0,4.77765886779809e-05,7.74212562624845e-05
"Portunus pelagicus","Omani Exclusive Economic Zone",0,0,0.0813219604596567,0.700955927205082
"Portunus pelagicus","Overlapping claim Chafarinas Islands: Spain / Morocco",0,0,0.000987706018534676,0.000987706018534676
"Portunus pelagicus","Overlapping claim Gibraltarian Exclusive Economic Zone",0,0,0.0107491110028986,0.0200896387893094
"Portunus pelagicus","Overlapping claim Glorioso Islands: France / Madagascar",0,0,6.41417420282686e-05,0.000305138544095544
"Portunus pelagicus","Overlapping claim Ile Tromelin: Reunion / Madagascar / Mauritus",0,0,0.000248386073684199,0.000293065947388543
"Portunus pelagicus","Overlapping claim Matthew and Hunter Islands: New Caledonia / Vanuatu",0,0,0.000125469252897147,0.000303163953182491
"Portunus pelagicus","Overlapping claim Mayotte: France / Comoros",0,0,0.000102065568374263,0.000370256478989331
"Portunus pelagicus","Overlapping claim Melilla: Spain / Morocco",0,0,6.90936060654994e-05,6.90936060654994e-05
"Portunus pelagicus","Overlapping claim Senkaku Islands: Japan / China / Taiwan",0,0,0.00236214754256994,0.0338130807787411
"Portunus pelagicus","Overlapping claim South China Sea",0,0,0.000594703369353877,0.00563687078183132
"Portunus pelagicus","Overlapping claim: Iran / United Arab Emirates",0,0,0.227395383085972,0.47719162013679
"Portunus pelagicus","Overlapping claim: Kenya / Somalia",0,0,0.000587521926212307,0.000883144957299421
"Portunus pelagicus","Overlapping claim: Sudan / Egypt",0,0,0.0550130147821919,0.0657243027094106
"Portunus pelagicus","Pakistani Exclusive Economic Zone",0,0,0.000610022325032591,0.0105525099995346
"Portunus pelagicus","Palau Exclusive Economic Zone",0,0,0.00126521082049994,0.00320645898690011
"Portunus pelagicus","Palmyra Atoll Exclusive Economic Zone",0,0,7.56288189553929e-05,0.000396320483292635
"Portunus pelagicus","Panamanian Exclusive Economic Zone",0,0,0.00934584612613954,0.125848366959204
"Portunus pelagicus","Papua New Guinean Exclusive Economic Zone",0,0,0.000544823812395561,0.102081376276441
"Portunus pelagicus","Peruvian Exclusive Economic Zone",0,0,0.442493256907594,1.73395715750028
"Portunus pelagicus","Philippines Exclusive Economic Zone",0,0,0.00464891137270691,1.41728726088635
"Portunus pelagicus","Qatari Exclusive Economic Zone",0,0,0.221399500509518,0.467730696533138
"Portunus pelagicus","Réunion Exclusive Economic Zone",0,0,0.000204729164052062,0.00110482184541341
"Portunus pelagicus","Samoan Exclusive Economic Zone",0,0,0.00102921207177236,0.0130109135940187
"Portunus pelagicus","Saudi Arabian Exclusive Economic Zone",0,0,0.122674315290458,1.06019077418214
"Portunus pelagicus","Seychellois Exclusive Economic Zone",0,0,4.715379719525e-05,0.000516871837024104
"Portunus pelagicus","Slovenian Exclusive Economic Zone",0,0,0.123504514663596,0.123504514663596
"Portunus pelagicus","Solomon Islands Exclusive Economic Zone",0,0,0.0006868004551845,0.0088194223407206
"Portunus pelagicus","Somali Exclusive Economic Zone",0,0,0.0047054904984337,0.0940558959030661
"Portunus pelagicus","South African Exclusive Economic Zone",0,0,0.0118431545833334,0.0486907659289229
"Portunus pelagicus","South Korean Exclusive Economic Zone",0,0,0.0825461578342129,1.28163572508395
"Portunus pelagicus","Spanish Exclusive Economic Zone",0,0,0.00540429336091992,0.0813551595551555
"Portunus pelagicus","Sri Lankan Exclusive Economic Zone",0,0,0.0163072487013852,0.410843890890605
"Portunus pelagicus","Sudanese Exclusive Economic Zone",0,0,0.12086484460867,0.237179677632864
"Portunus pelagicus","Taiwanese Exclusive Economic Zone",0,0,0.0171765271826853,0.444692343935345
"Portunus pelagicus","Tanzanian Exclusive Economic Zone",0,0,0.000410862941728419,0.00243631904948805
"Portunus pelagicus","Thailand Exclusive Economic Zone",0,0,0.00539069132748079,0.290094748346208
"Portunus pelagicus","Tokelau Exclusive Economic Zone",0,0,0.00270324952609519,0.00797714516447768
"Portunus pelagicus","Tongan Exclusive Economic Zone",0,0,0.000227313493749262,0.00382932744521535
"Portunus pelagicus","Tunisian Exclusive Economic Zone",0,0,0.0245250223674158,0.380401138646003
"Portunus pelagicus","Turkish Exclusive Economic Zone",0,0,0.0533142623647364,0.246336226893614
"Portunus pelagicus","Tuvaluan Exclusive Economic Zone",0,0,0.00657393524784963,1.14015492006131
"Portunus pelagicus","United Arab Emirates Exclusive Economic Zone",0,0,0.190694725064919,0.62580853832605
"Portunus pelagicus","United States Exclusive Economic Zone",0,0,0.0395316928293414,0.631697096586719
"Portunus pelagicus","United States Exclusive Economic Zone (Hawaii)",0,0,0.0258109832690985,1.58778979812912
"Portunus pelagicus","Vanuatu Exclusive Economic Zone",0,0,0.000133967534353008,0.00144242853929409
"Portunus pelagicus","Vietnamese Exclusive Economic Zone",0,0,0.00957980455115292,0.742321426017532
"Portunus pelagicus","Wake Island Exclusive Economic Zone",0,0,0.000684819319388706,0.000811884341533262
"Portunus pelagicus","Wallis and Futuna Exclusive Economic Zone",0,0,0.00772666545046958,1.14015492006131
"Portunus pelagicus","Yemeni Exclusive Economic Zone",0,0,0.00742102460512477,0.0940558959030661
