"Species","EEZ","p2","p4","Average","Max"
"Larimichthys crocea","Chinese Exclusive Economic Zone",0.506361323155216,0.229007633587786,3.06443179758552,8.2923610758136
"Larimichthys crocea","Japanese Exclusive Economic Zone",0.424698795180723,0.108433734939759,2.36202647293258,8.2923610758136
"Larimichthys crocea","Joint regime area Japan / Korea",0.466666666666667,0.0266666666666667,2.03938444101701,5.0240747416912
"Larimichthys crocea","Overlapping claim Senkaku Islands: Japan / China / Taiwan",0.550561797752809,0.337078651685393,3.83809129160992,8.2923610758136
"Larimichthys crocea","South Korean Exclusive Economic Zone",0.25,0,1.73518647581826,3.24823607640415
"Larimichthys crocea","Taiwanese Exclusive Economic Zone",0.563636363636364,0.377272727272727,3.78549797096432,8.2923610758136
